,Unnamed: 0,Unnamed: 0.1,text,label,lang,translated
0,0,3354,ูุง ุฃุณุชุงุฐ ูุฆุงู ุงูููุฏูู ูู ุณููู ุฅูู ุนู ูุฑูุจูู ุงููุตุต ูุด ุดุงุทุฑ ุจุนุชูุฏ ูุงุฒู ุชุบูุฑูุง ุนูู ูู ุญุงู ุฅูุช ุจุฏู ุงูููุฑุฉ,0,ar,"Mr. video harmony teacher, from years to years, the stories confuse you. I donโt have a belief that you have to change anyway.  "
1,1,3531,ูุน ุงุญุชุฑุงูู ููุงุชุจ ูุงููุตูุฏุฉ ููู ูุง ูุงู ุจุงููุณุจุฉ ุงูู ููู ุจูููู ูุจูุงู ูุจูุฑูุช ูุดุนุจ ูุจูุงู,0,ar,"With all due respect to the writer of this poem, who wouldn't be interested in following Lebanon, Beirut and the people of Lebanon?  "
2,2,1738,ุฑูููุฉ ููุฏู ุซูุงูุชู ููุงุฒู ูุฑุฏ ุนููู ุจุญุณุจ ุซูุงูุชู ูุฃุฎูุงูู,0,ar,"Heidi's companions are two cultures, and we must respond according to our cultures and morals  "
3,3,657,ููู ุจูุดุจู ููู ููู ุจุฏู ูุญุงูู ููู ูุง ูู ุงูุงุุณูุทุฉ ุงูุดุนุจ,0,ar,"All of them resemble all of them who want to be tried, who is the only authority of the people?  "
4,4,3209,ู ุงูุชูุง ูู ุงุฑูุงุจู ุงุฑุณูุชูุง ูู ุทุฑุงุจูุณ ูุณูุฑูุง ู ูุง ูุณูุงูุฉ,0,ar,And you are how many terrorists were sent from Tripoli to Syria and not forgotten  
5,5,378,ุงููุฏ ุฌุจุฑุงู ุจุงุณูู ุููู ูุฎูู ุงูุฏูุงุก,0,ar,"Sure, Gibran Basil, and does he hide the savvy?  "
6,6,883,ููุฏุง ุฌุจุฑุงู ุจุงุณูู ุงููู ุนูู ุงูุชุฎุงุจุงุช ูุบุชุฑุจูู,0,ar,"Haida Jubran Bassil, who made expatriate elections  "
7,7,1663,ุฃูุชุฑ ุดู ุญุจูุช ูุนุงููู ูุงูุณุงุทูุฑ ุงูุนุฑุจู ุงูููุฌูู ูุฐู ุฅุถุงูู ูู ุงููุฆุงุช,0,ar,"A lot, I liked your Excellency and the Arab cleaver guiding this addition of hundreds  "
8,8,1818,ูุงูุงุฎุชุฑุงุน ูุงุช ุฏู ูู ููู ุงุช ุฅู ุจุงููุณุชุงูู,0,ar,The invention is what you call it in ballistic  
9,9,3555,ุณุนูุฏู ุนุงูููู ูุง ุทุดู ุจูููู ูุจู ููููู ูุง ุจุฏู ุชุฎูู ุดู ูุจูุฑุง,1,ar,"Saudi sleep, Teshm, it will be enough for the day, you don't want to leave something early  "
10,10,3958,ููู ุชุณูุน ูู ูุง ูููู,0,ar,Do you hear what he says  
11,11,1148,ูู ูู ูุฒูุฑ ูููู ูุด ูุฐุงุจูู ุจุณ ุดูู ูุฌููู ููุจุฑุฉ ุตูุชูู ูุง ุจููุญููู ุฅูุง ุจุงููุฐุจุ ุฎูููุฉ ๐,0,ar,"In how many ministers it is possible not liars, but the form of insanity and tone of voice that only makes you lie with lies, creation  "
12,12,173,ูุง ุฑูุช ูููุณูุง ุจุฌูุงู ููุธุงูุฉ ูุทูุง ุดู ูุงู ุนุจุงููุง ุงููุดููุฉ ูุด ุจุงููุทู ุฃุณุชุงุฐ ูุฆุงู ูุดููุชูุง ุจุงูุดุนุจ ุซู ุจุงูุฏููุฉโฆ,0,ar,"I wish our souls were beautiful and clean, and what was our problem was not the homeland, a teacher of harmony, our problem with the people, then with the state ...  "
13,13,962,ููู ุฐุงุชู ุตุฏู ุงูู ูุญุงููุฉ ุงุบุชูุงู,0,ar,Self-assured that An assassination attempt  
14,14,668,ูุจู ูุง ุชุญูู ูุงูุญูู ุดููู ุงูุดุนุจ ุงููุจูุงูู ููู ุนู ุจูููุช ูุฏุงู ุงููุณุชุดููุงุช ูููู ูุด ูุงุฏุฑูู ูุฏูุน ููุนูุด ููุง ูุงููโฆ,0,ar,"Before you say this, look at the Lebanese people. The uncle will die before the hospitals, and we will not be able to pay to live or eat.  "
15,15,1861,ูุงูุณู ุจุงููู ุงูู ูุจูุฑ ุงูููุงูููู ูู ูุทุฑ ุงููู ุฏูุฑุช ุณูุฑูุง ู ุงูุณุนูุฏูู ุจุชุนูู ุงูู ุจุงููุทู ุงูุนุฑุจู ุจุงููู ุนููู ูู,0,ar,"I swear to God that you are the chief hypocrisy of Qatar, which destroyed Syria and Saudi Arabia by doing what in the Arab world  "
16,16,2143,ุดู ุงูุณุฑ ูู ูุง ูุนูู ุฌุจุฑุงู ุจุงุณูู ููุงุจูุฉ ูุน ูุญุทุฉ ุฃุฌูุจูุฉ ูุนุทู ุงูุญู ูุงุณุฑุงุฆูู ุจุงููุฌูุฏ,0,ar,The secret was that everything that Gibran Bassil does is an interview with a foreign station that gives Israel the right to exist  
17,17,1903,ุงูุตููุฑ ุฅุฌูุงูุง ุงููุฌููุนุฉ ุงูุงุชูุฉ ูู ุฎูููุฉ ุดูุนูููุฉ ุนุฑุงุณูู ุฌุจุฑุงู ุจุงุณูู,0,ar,"The falcons, in total, come from the Shimonian background of their wedding, Gebran Bassil  "
18,18,2759,ูุงููู ูุง ููุชุฑ ุฎูุฑู,0,ar,God does not care about your good  
19,19,3386,ูููุญ ูู ููู ุจูุตูููุง ุตูุชูุง ุฏูู ูุฒุจ ูููุงู ุงููู ูุฎููู ุจููุงุฌูุฉ ุงููุณุงุฏ ุงููุญุชู ูุงูุจูุฏ,0,ar,"Mounih, in Maine, we reached our voice without distraction and hypocrisy, may God protect you by confronting the corrupt corruption in this country  "
20,20,817,ุงู ูุง ูุจููุฉ ุบูู,1,ar,"Oh, Habila Sheep  "
21,21,1017,ููุฏุชู ุงูู ุญุฑุง ุงููุง ุงูุณุงูุฑุงุฆู,0,ar,"Your mother gave birth to you, free samurai  "
22,22,89,ููุด ูุง ูุงูุฑูู ุงูุง ุงููุฒูุฑ ุฌุจุฑุงู ุจุงุณูู ูู ุจุชูููุง ุดูู ุนู ุณูุงู ููุง ูุฌุฑ,0,ar,"Why did not you conquer, but Minister Gibran Bassil, if they decried about what he called us and dragged  "
23,23,842,ูุฏุงู ูููุง ููุงุจ,0,ar,So we are all wahab  
24,24,3275,ุงูุซุงููุฉ ูุนุงููู ููููู,0,ar,"The second, Your Excellency Hahaha  "
25,25,2728,ูู ุชุนูู ูุง ุนุฒูุฒู ุงู ูููุฉ ูููููู ูุงู ูุณุชุนูููุง ุงููููุงูููู ููุฏูุงูุฉ ุนูู ุงูู ุดุฎุต ูู ููุทูุฉ ุดุฑู ุงููุชูุณุท ูุงู ุณูุงู ุงูููุทูุฉ ูุง ูุงููุง ูุณููุง ุญุงูู ูููููููู,0,ar,"Did you know, my dear, that the word Phoenician was used by the Greeks to denote any person from the Eastern Mediterranean region and that the inhabitants of the region were not called the Phoenicians?  "
26,26,1954,ูู ูุง ุบุงูู ูุฒุนุชุง ูุนูุง ูุนููููููู ููุง ูุงุชุจ ุนุฏู ุนููู ููุง ูุฒูุฑ ูุญุชู ุณุฑูู ูููุง ูุงุญุฏ ูู ูุฏุฑุงุก ุนุงููู ุญุชู ุญ,0,ar,"To him, my dear  "
27,27,4059,ุฌุจุฑุงู ุจุงุณูู ุนุงุฑ ุนูู ุงูุนุฑุจ ููู ูุงูู ุงูุง ูุฑุฎ ูุฌูุณู ุฃุจุชููุช ุจู ุงูุฃูุฉ ุงูุนุฑุจูุฉ,1,ar,Gibran Basil is a disgrace to the Arabs as a whole. It is nothing but a Magusian chick that has plagued the Arab nation  
28,28,1046,ูุด ูุนููู ูููุฉ ุงูุฌูู ูุงูุบุจุงุก ูุงูุญูุฏ ุงูุงุนูู ุจุงูุฑุฏูุฏ ุดุนุจ ุจุณ ุจุนุฏ ูุงูุตูุง ุงูุฑุณู ุงูููุงุฑู ููุฌูุฏ ุจุณ ููู โ,1,ar,"It is not reasonable the amount of ignorance, stupidity and blind hatred in the responses. People, but after they lacked the halter, there is no heck.  "
29,29,2109,ุดูุฑุงู ูู ุนูู ูุฐุง ุงููุตู ุงูุฅูุงุก ููุถุญ ุจูุง ููู,0,ar,Thank you for this description  
30,30,2038,ุจุฎุตูุต ูููู ุฌุจุฑุงู ุจุงุณูู ุจุงููุณุจุฉ ูู ุงูุนุฏุงุก ูุน ุงุณุฑุงุฆูู ุงูู ููุณ ุฎูุงู ุงูุฏููููุฌู ุงูู ุจูุงููู ูู ุงูุจุญุซ ุงูุฐู ุชูุนุฏุชู ุจูุ,0,ar,"Regarding Gibran Bassil's position regarding hostility with Israel, it is not an ideological dispute. Where is your statement from the research that you were promised?  "
31,31,2560,ููุฏุง ูุณุชูุงู ูุง ุจูุง ุงุฎูุงู ููู ุจุชุญููุง ูุนูุฏูู ุนูููู ูู ููุฑูู ุชุฑุฏูุง ุจูุณุชูู,0,ar,"This is your level, without morals  "
32,32,2932,ูุง ุฑูุช ุญุฏุงุจูุนูููุง ูุนุงูุณูุงุณููู ุนูุง ุจุณ ุจุฏู ุงูุตุจุงุท ุตุงุฑูุฎ ุงุฑุถ ุฌู,0,ar,"I wish someone would do it with the politicians about us, but instead of Sabbat, a surface-to-air missile  "
33,33,3284,ูุฆุงู ููุงุจ ุจุชุนุทู ูุทุฑ ูู ุฏููุงุฑ ุจุบูุฑ ุฑุฃูู ูุฆุงู ุฏููุงุฑ,0,ar,Harmony of Wahab giving Qatar how many dollars without his opinion harmony dollars  
34,34,2608,ูุทุฑ ุฏูููุฉ ุงูุงุฑูุงุจ ูุงูุดุฑ ูู ุงูุนุงูู,1,ar,Qatar is a state of terrorism and evil in the world  
35,35,1015,ูุดุฑุชู ูููู ุจุชุนุฑูู ูุญุชู ุฃุตุญุงุจูู ุงููููุฏ ุฅููู ุงูุณูุฏ ุจุณ ูููู ุดู ูู ูุฏ ููุงูู ูุฐุง ุงูุณูุฏ ุงูุจุทู ุงูุดุฑูู,0,ar,"So you know, but you know, even your Jewish companions. The master, but Evol Shi Shi, has spoken to this honorable hero.  "
36,36,1657,ุฑุณุงูุฉ ูุฐุงุช ูุงุถูุฉ ุนุชููุฉ ูุงููู,0,ar,A message for an ancient past and by God  
37,37,2571,ุงูุจูุฏ ูุงูุดุฑูุงุช ุนู ุฃููุณ ุตุญูุญ ูุงูู ูู ุงูุจูุฏ ุฃูุซุงูู ูุฑุคุณุงุฆู ููู ูุนู,0,ar,The country and companies are true bankruptcy because in the country are people like you and your superiors and those with you  
38,38,3755,ูุฏ ูุณูุน ุงุญุฏูู ูููู ูุฑุงูุฉ ุนูุงุฏ ุนุซูุงู ูู ูุฑุงูุฉ ุฃูู ุงูุณูุฉ ูู ุจูุฏ ูุฑุงูุฉ ุงูุทูุงุฆู ููู ูุฑุงูุฉ ุงููุทู ูุงูููุงุทู,0,ar,We may hear someone say the honor of Imad Othman from the dignity of the Sunnis in the country of the dignity of the sects above the dignity of the country and the citizen  
39,39,405,ุทููุจ ููู ูุชูุฑ ุจุชุญุจ ุณูุฑูุง ู ุงูุงุณุฏ ู ุฏูุดู ุงุฐุง ุจุชุทูุน ุจุชุนูุด ููู ุจุชุฑุชุงุญ ู ุจุชุฑูุญูุง ู ุงููู ูุง ููุฒุนู ุฌูุฎ ูุจููุถ,0,ar,"Nice to you so much, you love Syria, Assad, and Damascus, so if you look to live above comfortably, and relieve us, God is not a bleaching fog.  "
40,40,3334,ููู ุฎูุต ุจููุ ุฎูุต ูุงููู ุงุฑุญู ุญุงููุ ููุฏู ุงูุตูุงุช ุตูุงุช ูุนููู ุงููุชู ูุงูุงุฌุฑุงู ูุงูุงุจุงุฏุฉ ุงูุฌูุงุนูุฉุ ุงุณุชุฑ ุนูู ุญุงูู ููุณุชุฑ ุงููู ุนููู ูุง ุฒููู,0,ar,"For you, there is no survivor, concluded, and God have mercy on you.  "
41,41,474,ุงูู ุงููุงุญุฏ ุจูุญููู ุจู ุงูุดุฑู ุจุชุฑุฏ ุจู ุงูุบุฑุจ ุ ููุฏุง ุดุนุงุฑ ุงูุชุฎุงุจู ูุง ุฑูุญ ุงูู ุจูุญูู ูุจูุงู ุงูุฑุฆูุณ ุงูููู ูุฌูุดู ุงููุทูู ูู ููุงุฆู ููุจูุงู ุจุณ,0,ar,"I am the one who will tell you, but the East will retaliate, but the West. This is an electoral slogan, my soul, your mother, protect Lebanon, the strong president, and the national army.  "
42,42,1134,ูู ูุณูุฑ ูู ุชูุฌููุงุช ุงููุดุงูุฎ ุงูุฃุฌูุงุก ููุตุฑู ุงููู ุนูู ูู ูุณุชุจุฏ,0,ar,"Whoever follows the directives of the evident sheikhs, may God grant him victory over every tyrant  "
43,43,709,ุญุณุจ ูุนุฑูุชู ุจุงููุฒูุฑ ุฌุจุฑุงู ุจุงุณูู ุ ุงูุง ุนูู ูููู ุจุงูู ูููู ุจุฃู ุดูุก ูุฎุฏู ูุตูุญุฉ ูุจูุงู ุจูุง ูู ุฐูู ุฒูุงุฑุฉ ุณูุฑูุง ุงุฐุง ุงูุชุถู ุงูุงูุฑ ุฎโฆ,0,ar,"According to my knowledge of Minister Gibran Bassil, I am sure that he will do anything that serves the interest of Lebanon, including visiting Syria if necessary ...  "
44,44,1265,ุงููู ูุง ูููููุง,0,ar,God do not succeed  
45,45,631,ูุญุชุงุฌ ุงูู ูููุณ ุฌุฏูุฏู,0,ar,We need new souls  
46,46,1050,ูุง ุนููู ููู ูุนูููู ูุชูุงุฑูู ูุงุญุฒุฑุชู ุดุนุจูุชูู ุน ุงุฏ ูุฌููุนู ููู ุงุณูุฏ ูุชู ููุจู,1,ar,"I have no eyes in the eyes of his help and their current, my popularity, as a group of black ants like your heart  "
47,47,161,ุฌุจุฑุงู ุจุงุณููุ ุจุชุญุจู ุงู ุจุชูุฑููุ ูุง ููู ุชููุฑ ุงูู ูุจุถุงู ูุจุจูุถ ุงููุฌ ููุฒูุฑ ุฎุงุฑุฌูุฉ ุณูุงุฏู ูุทูู ููู ุชุจูู ูุดููุชู ูุนู ุงู ุญุฒุจู ูุคุจโฆ,0,ar,"Gebran Bassil, do you like or hate him? You don't deny that I caught me and whitewashed as a national sovereign foreign minister, but my problem remains with him that his party repents ...  "
48,48,1529,ูู ุงูููู ูุญูู ููุชููุณู ููุฑูู ุงููุชู ุจูู ุงููุงุณ ุงูุณุงู ุญูููููุฏ,0,ar,"The most important thing is to tell, philosophize, and throw discord between people, a human being  "
49,49,1128,ูุฆุงู ููุงุจ ุงูุทุงุฆูู ุณุจู ููุตู ุงููุฑุฃุฉ ุงูุณุนูุฏูุฉ ุจุดูุงู ุงููุญู ููุฃุณู ุงูุฅูุงุฑุงุช ููโฆ,1,ar,"Sectarian harmony, Wahhab, previously described Saudi women as the shawl of coal, unfortunately the UAE did notโฆ  "
50,50,277,ุฃู ููุณู ูุง ููุณู ุดูุฏุงุก ุงูุฏุงููุฑ ุงู ุงูุฐูู ุณูุทูุงโฆ,0,ar,"To forget, do not forget the martyrs of Damour who fell ...  "
51,51,2448,ูู ูู ุนููู ุจุนุฏ ูู ุญุฏุง ุงู ูุฑุฌุน ูุจูุฑ ุจูุงูุจูุฏุ ูู ูุฑุง ุนูุงูููู ุงูุจูุฏ ููู ุจูู ููู ุตุงุฑ ุตุบูุฑ ุตุบูุฑ ุตุบูุฑ ุงููู ููุชูู ูููู,0,ar,"From all of your mind, after a large or a reference in this country? Whoever is behind your family, the whole country, who has become a small and a small, may God take revenge on you  "
52,52,3645,ุฎุฏู ูุงูุชุบุฑูุฏู ูุฑูุญูุง ูุงูู ุงูุชุฒุนุฉ ุงูุณูุฑุฉ ุงููุงุฑุจ ูู ุงูุนุฏุงูุฉ ุจูุญู ูุฒูุฑ ุงูุนุฏู ุฎุจุตูุง ูุจุงุฑุญ ูุงุฌู ุงูุนุฏู ูุงูุนุฏุงูุฉ ูุงูุฏุงุฎููุฉ,0,ar,
53,53,475,ูุงุฑูุช ูููู ูุซูู ุงููุฑ ูุทุฑ ููู ููุถ ุจูุทุฑ ุงูู ูุตุงูู ุงุฏูู ุงููุชูุฏูุฉ ูุงุฐุง ูุงู ุนูู ุงูุงุฑูุงุจ ูุงูุชู ุงูุงุฑูุงุจ ุจุญุฏ ุฐุงโฆ,0,ar,"I wish all of you, like the Emir of Qatar, follows the rise of Qatar to the refineries of the developed countries, and if it is against terrorism, then you are terrorism in itself ...  "
54,54,676,ุนุงุฌู ุฌุจุฑุงู ุจุงุณูู ูุฎุต ุจุงูุดูุฑ ุฃููุฑ ูุทุฑ ุงูุฐู ูุณุฑ ุงูุญุตุงุฑ ุงูููุฑูุถ ุนูู ุจูุงุฏู ููุตู ุฅูู ุจูุฑูุช,0,ar,"Urgent: Gebran Bassil, we thank the Emir of Qatar who broke the siege imposed on his country and arrived in Beirut  "
55,55,58,ุตุญุงูุฉ ุฃุฑุฏูุบุงู ุจูุดุช ุชุฎููู ุฃูุฑูุจุง ูู ููุฌุฉ ูุงุฌุฆูู ุฌุฏูุฏุฉ ุดููู ุงูุญุฏูุฏ ุงูุชุฑููุฉ ุฑุญ ุชุชุณูุฑ ุจูุด ููู ุจุฏู ูุญุงูู ูุทูุน ูู ุฅุฏูุจ,0,ar,Erdogan Balsht press fears Europe from a new wave of refugees formed by the Turkish border  
56,56,3172,ุฃุฑูุฏ ุฎุทุงุจ ูุงุญุฏ ููููุงุช ุงููุจูุงููุฉ ุชููู ููู ุงู ุงูุญุฑูุฑูุฉ ุณูุงุณูุฉ ูุงูุช ุฎุทุฃ ุชุฌุงู ูุจูุงู ููุงููุชู ูุฎุทุงุจ ูุงุญุฏ ุนู ูุณุงุฏ ูุจูู,0,ar,"I want one speech by the Lebanese forces, in which it says that Hariri was a political mistake towards Lebanon and its finances, and one letter about the corruption of his Prophet  "
57,57,4116,ุตุฏูุช ููุงุณุจู ุฌุฏุง ุฌุฏุง,0,ar,I believe it suits you very very  
