,Unnamed: 0,Unnamed: 0.1,text,label,lang,translated
724,724,3191,ุณูุฏูุน ุซูู ุงูุนุงูู ุงููุฌุฑูุฉ ููู ุจุนุฏ ุญูู ููููุง ูู ูููุนู ุงููุงู,0,ar,"He will pay the price of his criminal actions, even after a while that day, he will not pay him money  "
725,725,83,ูุนูุงู ูุง ููุงุณุจ ุงูุง ุฒูุงููุงุ ูู ุฒูุงู ุนูู ููู ุตูุช ุงูุฑููุจุถุฉุ ููู ุนูุฏูุง ุชุญูู ุงูุณุงุนุฉ ุณูุนูุฏ ูู ุงูู ุญุฌูู ููู ูุงโฆ,0,ar,"Indeed, it is only appropriate for our time, at a time when the voice of al-Ruwaida is over, but when the time comes, each will return to its size, even if ...  "
726,726,115,ูุง ุฌูุงุนู ุงููู ุจุฏู ูุฏุนู ุงู ููุจุฑ ุงู ูุตูู ุงู ูุฎุชู ุงููุฑุขู ุจุฅููุงูู ูุนูู ูู ูุงูุญูู ุจุนูุฏ ุนู ุชููุชุฑ ุจููุจููู ุซูุงุจ ุงูุชุฑ ูุฃูู ุงูุฑูุงุก ุจุงโฆ,0,ar,"O people who want to claim, grow up, pray, or complete the Qurโan, you can do all of this without the Twitter, then you will be rewarded more because you are showing off ...  "
727,727,3093,ููู ุจุฌู ุจุฏู ููู ูุณุฑุทู .ุทุฒ ุจููู ุดุนุจ ูููู ุฏููุฉ ูููู ูุถุงุก,1,ar,"The heck is the body of the heck, the carcinogen  "
728,728,4093,ุฏุฎูู ูุง ุญุถุฑุฉ ููุงุจ ุณุคุงู ููู ุตุงุฑ ุงููุชูููู ุจูุญุงููุฉ ูุชู ุจุทุฑุณ ุญุฑุจ ููู ุงููุฌุฑู ุจูุชู ุงูุถุงุจุท ุญูุง ููู ูู ุงููุชูููู,0,ar,"Your income, Mr. Wahhab. Question: Where are the accused persons of trying to kill Boutros Harb? Where is the criminal who killed the officer Hanna? Where are all the accused  "
729,729,3995,ุดุบูุชู ู ูุดุบูุชู ุจูู,0,ar,Your job and your mouthpiece  
730,730,2053,ุจุนูุฑู ุงูุณูุฑู ูุง ุฑุญ ูููู ูู ุฎูุฑ ููุงูุจูุฏ ููู ูุชุญููุจู ูุฒูุญ ููููููู ุณูุฑู ููุง ุจูุฏ ุจุงูุนุงูู ุงุณุชูุจู ูุงูุนุฏุฏ ูุณุจุฉ ูุญุฌูู ูุชุญูู ูุง ุชุญูู ุชุจุนุงุช ุงูุชุตุงุฏูุฉ ูุฃูููุฉ ูุจูุฌู ูุงุฆุจ ุณูุฑู ุฌุฑุจุงู ุจุฏู ูุง ูุดูุฑ ูุจูุงู ุจููู ูุจูุงู ุงุณุชูุงุฏ ูู ุฃุฒูุฉ ุงููุงุฒุญูู! ุทูู ุนูุฑูู ูุฑุญ ุชุจููุง ูุฌุณูู,1,ar,"With his Syrian life, he will not be in the best interests of the country, and you have endured the displacement of two million Syrians, and no country in the world has received this number in proportion to its size and endures what bear economic and security consequences. Your longevity and you will remain unclean  "
731,731,2895,ููุดุงุฑ,0,ar,saw  
732,732,2529,ุงุนูุงู ุฑุฎูุต ูุจูุง ูููุนุฉ ุนูููุง ุงุฏ ุฑุจุน ุฌุจุฑุงู ุจุงุณูู ูุฑุฌุนู ุญููุง ุฑูุญูุง ุนูููุง ุซูุฑุฉ ุนุง ูู ููู,0,ar,"Cheap and useless flags, they worked for a quarter of Gebran Bassil, and they came back, they said, they made a revolution for me here  "
733,733,1193,ูููู ูู ูุตููุฉ ุงูููุงุจ ุงูุฎููุฉ ุงููุฑุชุฒูุฉ ูุง ุงุณุชุซูู ูููู ุงุญุฏ ูุจูุงู ุจุญุงุฌุฉ ูุงูุชูุงุถุฉ ุงุฐุง ุฃุฑุงุฏ ุงูุฎูุงุต ูู ูุณุงุฏูู ูุนูุฑูู,1,ar,"All of you are from the family of traitorous dogs. Mercenaries do not exclude any of you from Lebanon, who needs an uprising if he wants to be saved from your corruption and your life.  "
734,734,2922,ูุฌุจ ุนูู ุงููุถุงุก ูุญุงููุฉ ูุตูุต ุงููุงู ุงูุนุงู ููุบุชุตุจู ุงูุงููุงู ุงูุนุงูุฉ,0,ar,The judiciary must try public property thieves and rapists of public property  
735,735,1719,ูุดุงุฑูุฉ ุดูุฎ ุงูุบุฑูุจ ูู ุชุฃุช ูู ูุฑุงุก ุซููู ููู ูุนู ูุง ูุจูุฑ ุฃุชุช ูู ูุดุบููู ูู ุงูุบุฑู ุงูุณูุฏุงุก ูููุงูุงูู ุงูุฅุฌุฑุงููุฉ ูุฒุฑุน,0,ar,Sharing Sheikh of the stranger did not come from behind your weight and who is with you O chief came from your operators in the black rooms and their criminal intentions to plant  
736,736,459,ูุฐูู ููุณูู ุจูุญุจูุง ุงูุงุณุฏ ููุนุชูููู ุงู ุงูุซูุฑุฉ ุงูุณูุฑูุฉ ูุคุงูุฑุฉ ููุคูุฏูู ูุตู ุงููุฏูููู ุจุตุฑุงุญุฉ ุฃุฒุจู ูู ุงููููู,1,ar,The same stupefied people love Assad and are arresting that the Syrian revolution is a conspiracy and openly supports the bombing of civilians from the right.  
737,737,3675,ูุฏ ูุง ูู ุงูุนูุฏ ููู ูุฎุงูุชู ููุดุงู ุนูู ู ุตูุฑู ุงููู ุฏุงุนูู ุฌุจุฑุงู ุจุงุณูู ุงุฎุฐูุง ูุฑุงุฑ ููููุง ุงูุนูุฏ ุจูุง ุญูููุฉ,0,ar,"Drive what is the covenant strong, so Michel Aoun and his brother-in-law, the supporters of Gibran Bassil, took a decision to end the covenant without a government.  "
738,738,3694,ููููููููููู ูู ูููู ูุฐุง ุฌุจุฑุงู ุจุงุณูู ุงููุณูุญููู ูุฑูุฏูู ุชุทุจูุนุงู ูู ููู ุงูุทุงููุฉ,0,ar,ูู ูู ูู ูู ูู ูู ูู ูู ุงู ูุฑูุฏูู ูู ูุฑูุฏูู ูุฑูุฏูู ุงู ุงู ุงู ุงู ุงู ุงู ุงู ูุฑูุฏูู ูุฑูุฏูู ูุฑูุฏูู ูุฑูุฏูู ูุฑูุฏูู ูุฑูุฏูู ูุฑูุฏูู ูุฑูุฏูู ูุฑูุฏูู Gebran Bassil  
739,739,3780,ูู ูุงุญุฏ ุทูุน ุดุฑุด ุนูููู ุจ ุฏุงุฑู ุงูููู ููุง ุงูุชู ููู ุงูููู ุตุงุฑ ุฏุจุดุฉ ูุจูุฑุฉ ุจุฏูุง ูุต,0,ar,"In one thing, a black shark that rises to Daru neglected and what he cared about today has become a big dabsha rather it was cut  "
740,740,3888,ูุฐุง ูุฏูุฑ ูุทุฑู ูุงูุฏุฑู ุงู ุงููุฑ ูุทุฑ ุณูู ูุทุฑ ููุชุฑูู ุงููุงุณู ูุนูู ุฎููู ูุดุฑุฏ,1,ar,"This revolves around a Qatari, so it does not know that the Emir of Qatar has handed Qatar over to a lewd Turkish man, meaning you are homeless  "
741,741,3106,ููู ูู ุฏููู ุจูุจูุงู ูู ุฏููู ูู ููู ุงูุฏู ุงูู,0,ar,"Why in my country in Lebanon is my country, I support God  "
742,742,2700,ุตุงุญุจ ุงููุตูุฏุฉ ุดุฑูู ุงููุฑุถุงูู ูุญุงูุธ ุงููุฑุขู ูุฅูุงู ุงูุญุฑู,0,ar,"The owner of the poem is a partner of Al-Qaradawi, Hafiz Al-Quran and Imam Al-Haram  "
743,743,449,ุณูุนุชูุง ูููุญ ุณูุงุญุฉ ุงูุณูุฏ ุดู ูุงู ุนู ูุฎุงูุฉ ุงูุฑุฆูุณ ูุนู ุงููุฒูุฑ ุฌุจุฑุงู ุจุงุณูู ุจุนุชูุฏ ูุง ููุงู ุจุนุฏ ููุงู ุงูุณูุฏ,0,ar,"I heard Munih His Eminence Sayyid Shu said about His Excellency the President and of Minister Gibran Bassil, I think no words after the words of the Master.  "
744,744,877,ุงูุจุดูุฑ ูุงู ููุชุนุงูู ูุน ุงูุดูุงุทูู ูุฑูุงู ูุตูุญุฉ ูุจูุงู ุงููุง ููู ุงููุดููุฉ,0,ar,"Al-Bashir said we are dealing with demons as the sand of Lebanonโs interest first, and where is the problem?  "
745,745,1873,ุถุฑูุฑู ูุญูู,0,ar,Necessary to tell  
746,746,4042,ุชุตุฑูุญุงุช ุฌุจุฑุงู ุจุงุณูู ูุณุชูููุฉ ูู ุงููุฑุงุฑ ููู ูุฒุงูุฏุฉ,0,ar,Gibran Bassil's comments inspired by the decision is enough for bidding  
747,747,365,ุชุณูู ูุง ูุงุฆุฏ ุฏุงููุง ุจุชุญุท ุงูููุท ุนุงูุญุฑูู ุณูุทุฉ ูุงุณุฏุฉ ูุนุงูุฑุฉ ุณูุจูุง ูููุจูุง ุงูุจูุฏ,1,ar,"O Commander, I always receive the drops  "
748,748,195,ูุฃููู ุงุจุฏุฃ ูุดูู ูุง ุจุทู ูุจูู ุจุฑูุ ุณุนุฏ ุงูุญุฑูุฑูุ ุญุณู ูุตุฑุงูููุ ุฃููู ุงูุฌูููุ ุฌุจุฑุงู ุจุงุณููุ ููููุง ูุชูุดุ ูููโฆ,0,ar,"May God begin with Shouf, the hero of Nabih Berri, Saad Hariri, Hassan Nasrallah, Amin Gemayel, Gebran Bassil, Nicola Fattoush, and me ...  "
749,749,679,ูู ุจูุนุฑููู ุจูุนุฑู ุฅูู ูุงูุฌููุฉ ูุงูููุง ุฃูู ูุฑุฉ ุจูุชูุฑ ููุงูุดุงุชุ ูููุฃ ูุงููุง ุงูุณููุฏ,0,ar,Let me know me. We know that this is a sentence that has been said a thousand times in many discussions  
750,750,3084,ุฌุจุฑุงู ุจุงุณูู ูุบุฑูุฏ ุนู ุฑุญูู ูู ููุณู ูุจูุงู ุณููุชูุฏ ุฑูุญู ุงูุฌูููุฉ,0,ar,"Jubran Basil is absent from the departure of May Manasseh Lebanon, he will miss your beautiful soul  "
751,751,598,ูุง ุชุญูุฉ ููุง ุณูุงู ูููุดุงู ุนูู ุนูู ุฏูุฑู ููุณุงููุชู ุจุดู ูุญุฏุฉ ุงูุตู ุงูุฏุฑุฒูุ ููููู ูู ููุฃูุซุงูู ูุญู ุจุงููุฑุตุงุฏ ูููโฆ,0,ar,"There is no greeting or peace to Michel Aoun for his role and his contribution to the unity of the Druze rank, and we tell him and his ilk we are looking for all ...  "
752,752,580,ูุญู ูุง ูููุฑ ุงูุชุงุฑูุฎ ุตุฏุงู ุงุฑุชูุจ ุฎุทุฃ ูุจูุฑ ุฌุฏุงู ููุญู ุงุชุฎุฐูุงโฆ,0,ar,We do not deny history Saddam made a very big mistake and we made ...  
753,753,918,ุตุงูุฑ ููู ูุน ุนูุงุก ุงูุฎูุงุฌุง ูุชู ุฑุงุฌุญ ุจุงููุณุฑุญูุฉ ูุน ุจูุงุน ุงูุฎูุงุชู,0,ar,Sayer Vic with Alaa Al-Khawaja Mithal Rajeh in the play with the sale of the rings  
754,754,1875,ุงูุช ูู ุงููุถุงูุฉ ูุง ูููููู,0,ar,You are all digestive oh haha  
755,755,2471,ุงูุช ุงููุงุฆุฏ,0,ar,You are the leader  
756,756,3253,ูุงูุช ุงุนุชุฐุงุฑุงุชู ูู ุงูุดูุฎ ุณุนุฏ ุงุฎุฏุง ุจุนุถุง ูู ุงุฐุงุนู ูุงุฐุงุนู ูู ุชุฑูู ุจููู ูุงุนูุจููุจุถู ุญูุฌู,0,ar,My apologies from Sheikh Saad were taking some of his radio to broadcast it to you.  
757,757,3330,ุทูุจ ุงูุช ูุง ุงุณุชุงุฐ ูุฆุงู ุซุฑูุชู ูู ููู ุ ุตุญูุญ ููุช ุชุจูุน ุจุทูุฎ ุ ููู ุงูุจุทูุฎ ูุง ูุฌูู ูุชู ููุฐุง ูุตุฑ ุชูููู ูุงููู,0,ar,"Ok, you teacher of harmony, where are you from? Were you selling watermelon? But watermelon does not harvest such minors that God has  "
758,758,434,ุงููุคุณู ุงู ุงูุงุณุชููุงููููู ูุงูุชุจุนููู ููููุง ูู ูุฌู ุงูุญููู ููุชุฏููุฑ ุงูุจูุฆู ุจูููุง ุงููุงุฌุจ ุงููุทูู ูู ูุชุญุฑู ุนูโฆ,0,ar,"Unfortunately, the independence and dependencies stood in the way of solutions to environmental degradation, while the national duty did not move from ...  "
759,759,2886,ุฌูุงุนุฉ ุณุนุฏ ุงูุญุฑูุฑู ูุงูุญุฑูู ูุจุนุถ ูุญุชุฑู ุงููุตุจ ูุงูุจููุฉ ูุณุชุญููู ุงููุณุฑ ุงูุจุนุถ ููุนูู ุณูููู ูุณุชุญู ุงูุฑูุน ููููู ููุงุจ ุณููุงู ุงูุฐู ุชุญุช ุดุญุงุทุชู ูุถููู,1,ar,
760,760,895,ูุฐุง ูู ุงูููุฌ ุงูุตุญูุญ,0,ar,This is the right approach  
761,761,1252,ูุง ูุงููู ุงููุทู ุจุญุงุฌู ูุง ุฑุญูู ูู ูุงูุณูุงุณููู ูุงูุฒุนุฑุงู ูุงูุงูุทุงุนููู ุณุงุนุชูุง ุจูุธุจุท,0,ar,"No, by God, the homeland needs, not the departure of all politicians, thugs, and feudal lords  "
762,762,3593,ุฌูุฑุฌ ุฑูู ูุงุตู ูุฑุชุดู ููุจ ูุซูู ุฑุญ ูุดูู ูุฏูุด ุฌูุฑุฌ ุฑุฒู ุจุฏู ูุจูู ูุงุตู ูุงุณุฏ ุฃูุช ูุง ุดุฑูุณู ูุด ูุทูู ููุง ุนููุชู ูู ุงููู,1,ar,"George Rook Qassi, a bitch like a dog like you, we will see Qadish George Rizk.  "
763,763,117,ุฃูู ุดูุฑ ูุงู ูููุฒูุฑ ุฌุจุฑุงู ุจุงุณูู ุดู ุฑุฃู ุงูุดุจุงุจ ุ ุจุชูููุช ูุตุฑุงููู,0,ar,"The first thanks was to Minister Gibran Bassil Shaw, the opinion of the youth? Nasrallah time  "
764,764,1826,ุงููู ุฎูู ุจุงูุฎ ุชุฑูุชูู ุงููุถุงูุฉ ุงูู ููููู,0,ar,"Ok, Khaiyi tired, you left the digestion  "
765,765,2354,ุฌุจุฑุงู ุจุงุณูู ุงูุฑุฌู ุงูุฐู ูุง ููุงู ูุฏู ููู,0,ar,"Gibran Basil, the man who does not sleep, is the same  "
766,766,3012,ุงุฐุง ุฌุจุฑุงู ุจุงุณูู ุจุฏู ูููู ูููู ุดูุนูู ุงู ุจุดูุฑ ุงูุฌููู ุงูุซุงูู ุทูุจ ููู ูุง ุจููู ูุชู ุงูุฌูุฑุงู,0,ar,"If Gebran Bassil is a Bedouin, it is Camille Chamoun or Bashir Gemayel II, so why shouldn't he be the same as the general?  "
767,767,1123,ููุฐุง ูู ุญู ุงููุฒูุฑ ุงูููู ุฌุจุฑุงู ุจุงุณูู,0,ar,"This is the right of the Minister, King Gibran Bassil  "
768,768,2141,ููุงููู ุงูุฅุนูุงู ุจุฏุง ุซูุฑุฉ ุนูู ุงูู ุนู ูููู ูุญุทุงุช ุชููุฒููููุฉ ูุจุซ ุดุงุฆุนุงุช ุนูู ุงูุนูุฏ ููุฎุงูุฉ ุงูุฑุฆูุณ ูุนูู ูุฒูุฑูุง ุงูููู ุฌุจุฑุงู,0,ar,"Media day-revolution has begun a revolt against those who finance TV stations to spread rumors about the Covenant and His Excellency the President and our Minister, King Gibran  "
769,769,3979,ูู ููุณู ุฃูู ุณูุฑูุง ุงููุฌุฑู ุฃุจู ุตููุงูุฎ ุงููู ุจุฏู ูุญุฑุฑ ุงููุฏุณ ุจุณ ูุฎูุต ุฃูู ุนูู ูุณุงุก ูุฃุทูุงู ุณูุฑูุง,0,ar,"The people of Syria will not forget the criminal Abu Sawayikh who wanted to liberate Jerusalem, but he will first save Syria's women and children  "
770,770,2706,ูููุง ูุงู ุงูุดุงุนุฑ ุงููุฑุฒุฏู ุงูุณูุงุญ ุงูููุนู ุณูุตู ูุฑูุจุงู ุจููุดูุช,0,ar,"As the poet Farazdaq said, the specific weapon will soon reach Bolsheit  "
771,771,1101,ูุซุฑุฉ ุงูููุงู ุซุฑุซุฑุฉ,0,ar,Frequent talk  
772,772,1891,ูู ูุงููู ุนูู ุนูุงุฏ ุนุซูุงู ููุท ุงุฐุง ุฏูููุง ุจูุถุน ุงูุจูุฏ ูุฌุฏ ุฃู ูุถุนู ุงููุงุฑ ูุณูุท ูู ุงุณูุทู ูุง ุฃุญุฏ ูู ููุจู ูุง ุฃุญุฏ ูู ุงูู,0,ar,"She is standing on Imad Othman only if we check the situation of the country, and we find that his situation collapsed and fell from the one who brought it down, no one who looted it, no one from a thousand  "
773,773,205,ููู ูุฏุฑ ููุตูู ุฑุณุงูุฉ ูุฌูุจ ูุดุงุฑูุฉ ุณูุฑูุง ุจุงูููุฉ ุงูุนุฑุจูุฉ ูุนุฏู ููุงุทุนุชูุง ุจุทุฑููุฉ ุงูุถูุ ูุจูู ุจุฑู ุงู ุฌุจุฑุงู ุจุงุณููุ ุงูุงูู ุงุณุชุนูู ุงูุจูโฆ,0,ar,"Who can communicate the message that Syria should participate in the Arab summit and not boycott it better, Nabih Berri or Gebran Bassil? The first one I use ...  "
774,774,333,ุจูู ุจุฑููุฑ ุงูุฐู ููุจ ุงูุนุฑุงู ุจุนุฏ ุงูุฅุญุชูุงู ูุญู ุงูุฌูุด ุงูุนุฑุงูู ูุชููู ุนุงู ูู ููุฏู ุญุฐุงุก ุงูุตุญุงูู ูุงุณุฑ ุงูุณุงูุฑุงุฆู,0,ar,"Paul Bremer, who looted Iraq after the occupation and disbanded the Iraqi army, receives a year in London the shoes of journalist Yasser Al-Samarrai  "
775,775,2945,ุงูุญูุฏุงููู ุงูุฐู ูุดู ุฏูุฑ ุงูุงูุงุฑุงุช ุงูุงุฑูุงุจู ูู ุญูู ุงููุคูุฑุงุช ุถุฏ ุงูุณุนููู ููุดุฑูุน ูุญูุฏ ุจู ุฒุงูุฏ,0,ar,"Praise be to God, who revealed the terrorist role of the Emirates in the neighborhood of conspiracies against the Saudi and the Mohammed bin Zayed project  "
