,Unnamed: 0,Unnamed: 0.1,text,label,lang,translated
1459,1459,3794,ูู ุจุชุฎุฑุณ ููุง ุงุญูุงูู ุงูููุน ุดููุฉ ูุฌูุณ ูุงุฌุฆ ุนูุฏูุง,1,ar,"If there is a silence, and will not be replaced, the fate of a naturalized refugee will be taken from us  "
1460,1460,786,ุงูุณุงูุฉ ุญุฑุฉ ูุตุงุฏูุฉ ูุน ููุณู ููุน ุงููุงุณ ุงูู ุญูุงูููู ููุงุจุชุบูุฑ ูุจุฏุฃุฆู ูุน ุชุบููุฑ ุงูุธุฑูู ูุงูุฏุงุนููู,0,ar,
1461,1461,3789,ูุจุงูููุงุณุจุฉ ุงูููุงู ูุทุงู ุงููุซูุฑูู ููู ูุนูููู ุนูู ููููุฉ ุงูุฃููุฑ ููุฃุณู ุถูุนุงูู ูุง ูุจูุงู,0,ar,"By the way, the article affects many who work to roll things out, unfortunately, your loss, Lebanon  "
1462,1462,3145,ุชูุงุฑ ุงูุนุงุฑ ุงูุจุฑุชูุงูู ูู ุชูุงุฑ ุงูุบุฏุฑ ููุง ุบุฏุฑู ุจุงูุญููู ูุงูููุงุช ูุงูููุจูุง ุนูู ุงุชูุงู ูุนุฑุงุจ ููููุจูู ุงูุงู ุนูู ุงูุดูุฎ ุณุนุฏ ุงูุญุฑูุฑู ุชููููููู ุนูู ุงูุดุฑูู ูููู,1,ar,"The stream of shame orange is the stream of treachery, as they betrayed al-Hakim and the forces.  "
1463,1463,3266,ุฑุงุฌุน ุญุณุงุจุงุชู ุฏูุชูุฑ ุนูู ูุน ูุฐุง ุงูููุงููุ,0,ar,"Review your accounts, Doctor Ali, with this hypocrite?  "
1464,1464,2844,ููุงูู ุชูุงุฌุฑ,0,ar,Minawi migrate  
1465,1465,3698,"""",1,ar,"""  "
1466,1466,397,ูุชููู ุฃู ูุง ููุธุฑ ุนูููุง ุฃุญุฏ ุจูุญุงุฑุจุฉ ุงููุณุงุฏ ุจุนุฏ ุงูููู ุฅุฐุง ูู ูุชู ุณุฌู ุนูุงุฏ ุนุซูุงู ูุงููุฐููุฑ ูู ุฌุฑูุฏุฉ ุงูุฃุฎุจุงุฑ ูุทูุญ ุจุฏููุฉโฆ,0,ar,"We hope that no one will look at us by fighting corruption after today if Imad Othman is not imprisoned, so what is mentioned in Al-Akhbar newspaper topples a country ...  "
1467,1467,4019,ูุงููู ุฌุจุชู ุงูุจูุฏูุฉ ู ุงูู ูุงูู ุจุชุณุชุงููููุง ุงูุชู ูุง ุจููุจูููู ูุชู ุงูุดูุฎ ุณุนุฏ ูุญุชุฑููู ููุง ูุฑุฏ,0,ar,
1468,1468,3833,ุถูุงุน ุงููููุฉ ุงูุณูุฑูุฉ ููุฃ ูุญูุง ุณูุฑููู ููุง ุนุฑุจ ุณูุฑููู ููุง ูุฑุฏ ุณูุฑููู ููุง ุขุดูุฑ ููุง ุณุฑูุงู ููุง ุชุฑููุงู,0,ar,"Lost the Syrian identity. Are we Syrians, no Syrian Arabs, no Syrian Kurds, Assyria, Syriacs, or Turkmen?  "
1469,1469,555,ุตุฑุงุน ุงูุฌุจู ุฑุณุงุฆู ุณูุฑููุฉ ูุฌูุจูุงุทุ,0,ar,
1470,1470,284,ุตุญูุญ ููู ูุงูุช ูููู ุจุณ ููุฑู ุจูููู ุงูุช ููุตูุญู ุณูุฑูุง ููู ููุตูุญู ุฌููุจูู,0,ar,"It is true that you are one of them, but only for the difference between you, you are in the interest of Syria and they are in the interest of their pockets  "
1471,1471,3536,ุชุถุฑุจ ููู ูุญุฒุจ ุงููุงุช ุนูููุก ูุงุทุดู,1,ar,Beat you from the Lat party Cats  
1472,1472,3582,ุนุงูุญู ูุง ุญููุง ุดู ุชุญูุงุชู,0,ar,"Do you have the right, my regards  "
1473,1473,3104,ุทุจูุนู ูู ูู ุงูุฏููุง ุชููู ุจุชุนุฑู ุจุณ ูุนูู ุดู ููู ููุง ููู,0,ar,"It is not normal for the whole world to know, but it means nothing from it or not  "
1474,1474,1425,ุญูุงู ุงููู ูุง ุฒุนูู ููุงูู ุตุญ,0,ar,"God protect you, O leader of your words, right  "
1475,1475,2569,ูุนู ููุงุฎุฑ ุงุจู ูุงุฏู,0,ar,With you to the other Abu Hadi  
1476,1476,96,ูู ููุงูู ูุฒูุฑ ุฎุงุฑุฌูุฉ ูุจูุงู ุฌุจุฑุงู ุจุงุณูู ุงููุคูุฏุฉ ูุจุดุงุฑ ุงูุฃุณุฏ ูุง ูู ุฃุจุนุฏ ูู ุงูุณูุงุณุฉ ุงูุชูุณูุฑ ูู ุงูุทุงุฆููุฉ ุงููุงูุนุฉ ุงูุชู ูุตุฏุฑ ุนโฆ,0,ar,"In the positions of Lebanonโs Foreign Minister, Gibran Bassil, in support of Bashar Al-Assad, there is no way beyond politics. Interpretation of the brutal sectarianism that is issued byโฆ  "
1477,1477,3864,ููุฏุง ูุณุชูุงู ูููุฏู ุฃุฎูุงูู,0,ar,This is your level and your ethics  
1478,1478,562,ุงูููุฉ ุงูุชููููุฉ ุฃูุฑุช ุงูุชุฑุงุญุง ูุจูุงููุง ูููุง ูู ุดุฃู ุฃุฒูุฉ ุงููุงุฒุญูู ูุงููุงุฌุฆูู ุณูุฐูุนู ูุฒูุฑ ุงูุฎุงุฑุฌูุฉ ูุงููุบุชุฑุจูู ูู ุญูููุฉ ุชุตุฑูู ุงโฆ,0,ar,"The development summit approved an important Lebanese proposal regarding the crisis of the displaced and refugees, to be broadcast by the Minister of Foreign Affairs and Expatriates in the ...  "
1479,1479,741,ููุช ุจุฏู ุงูุชูุง ูููุช ุญุฏุงู ุณุจููู,0,ar,I wanted to find an end before me  
1480,1480,1750,ุชูุชููู ูุณุงู ุงูุญุณู ูุชุชุฑุญููุนููุฉ ูู ุฃู ุฃุตูุงู ุงููุฎูููุงุช ุฃูุชู,0,ar,You kill Wissam El Hassan and Tarmouliya from any of the creatures you are  
1481,1481,1953,ุฎูู ููููุง ุญุฏุง ูุญุธุฑ ุงูุดุชุงููู ูููู ุจุนุจุฑ ุนู ุฑุฃูู ุจุฅุญุชุฑุงู ุฃููุง ูุณููุง ููู,0,ar,"Khayi has assigned an end prohibiting insults and follows with an opinion of respect, welcome  "
1482,1482,3719,ุฑูุญ ูู ูุฌูู ููุงู ููุงุจู ูุฌุณ ููุง ุญูู ุจููู ุชูู,1,ar,"Soul from my face, and you are impure, impure  "
1483,1483,1714,ุณูุฉ ูู ุณูุฉ ุงูููุงูุฑุฉ ุจูุตูุฑ ูุจูุงู ูุดุนุจู ูู ุณูุฉ ุชุตุฑูู ุงูุงููุงู ุจุญุฌุฉ ุชุตุฑูู ุงูุงุนูุงู ูู ุณูุฉ ุงูุณุฑูุฉ ุนู,0,ar,"A year is the year of gambling with the fate of Lebanon and its people. It is the year of spending money on the pretext of doing business, it is the year of theft  "
1484,1484,2450,ุฌุจุฑุงู ุจุงุณูู ููุงูุฉ ุจุฑุฆูุณ ูุฌูุณ ุงูููุงุจ ุงูููุฒูููู ูุคูุฏ ูุงุฏูุฑู ุญุชู ูู ุงูุฒุนุฌุช ุงูุฑููุง,0,ar,"Gibran Bassil Nkaia, Speaker of the Venezuelan House of Representatives, supports Maduro, even if America is annoyed  "
1485,1485,711,ุดู ูู ุงููุจุงุฑ ูู ุญูู ุงูุตุบุงุฑ ุงููุฒูุฑ ุงูููู ุฌุจุฑุงู ุจุงุณูู ุฃูุช ูุจูุฑ ูุจุชุถูู ูุจูุฑ ูุฃูู ุฅูุณุงู ุดูู ููุชูุงุถุน ูุณูุจุฑ ุดุบููโฆ,0,ar,"What are the adults from the young narrators, the Minister, King Gibran Bassil, you are big and you are very big because you are a magnanimous, humble and super-working person ...  "
1486,1486,782,ูุงู ูุฏููุง ุงูุงุณุงุฆุฉ ููุณุนูุฏูุฉ ููุท ุนุจุฑ ุชูููู ุงูุงูุงุฐูุจ ูุนุงุฏุฉ ูุคูุงุก ุงูุบุฌุฑ ูุนูุง ููู ุชูุฑุทุช ูุน ุญุณุงุจ ุงููุฑููุฌ,1,ar,"Her worst goal was for Saudi Arabia only by fabricating lies as usual these Roma people are with us, but she got involved with Norway's account  "
1487,1487,765,ููุง ูุทูุน ุฒุนูู ุนุฑุจู ูุณูุญู ุงููู ููู ุฌุจุฑุงู ุจุงุณูู ู ูุญูู ุนู ุชุนุฏู ุงุณุฑุงุฆูู ุนูู ูุจูุงู ุนููโฆ,0,ar,"When an Arab Christian leader, who is Gebran Bassil, talks about Israelโs aggression against Lebanonโฆ  "
1488,1488,720,ุงููู ูุญูู ุฃุตูู ูุง ุงุณุชุงุฐ ูุฆุงู,0,ar,
1489,1489,836,ุจุตุฑุงุญู ุฑุงุถู ุนู ููุณู ูุงูุช ุชุฏุงูุน ุนู ุฌุจุฑุงู ุจุงุณูู ูููููููู,0,ar,"To be honest, you are satisfied with yourself and you are defending Gibran Basil Hahahahaha  "
1490,1490,2028,ุตุจูุญ ุฑุจู ูุง ุฑุฌู,0,ar,"May God bless you, man  "
1491,1491,3906,ูุฌุจ ุฃู ูุนูู ุงูุฌููุน ุฃู ุงูุดุฌุฑุฉ ุงููุซูุฑุฉ ุชุฑุดู ุฏุงุฆูุง ุจุงูุญุฌุงุฑุฉ,0,ar,Everyone should know that a fruitful tree always threw stones  
1492,1492,2227,ููู ููุด ุญุงุทุท ุจูุนุงุฑู ููููู,0,ar,And why don't you have a cover?  
1493,1493,3107,ุจุนุฏ ูุงูุญุงุฏุซุฉ ูุงุฒู ุงูุฏููุฉ ุชุตุฏุฑ ูุฑุงุฑ ุงูู ูุงุฒู ูู ูุงุทูุฑ ุจูุงูุฉ ูููู ุนูุฏู ูุฑุด ุชูุง ููุฏุฑ ููุฑู ูู ูุชุญุฉ ุงูุชุชุฎูุชุฉ,0,ar,"After this incident, the state must issue a decision, that every building worker must have a building that is estimated to be breaching from its hatch.  "
1494,1494,3921,ุฌูุงุนุฉ ุงูุชูุงุฑ ุงููู ูุญููู,0,ar,The stream of God protects you  
1495,1495,425,ูู ุงููู ุจูุฑุดู ูุงูุณูุงุณููู ุงูุนุฑุจ ุจุงูุณุฑุงูู ุจููู ุดู ูุชูุฑ ูููุญ ุนูู ุงูุงูู ุจูุนุฑููุง ูููุชูู ุนูุฏ ุงูุดุนูุจ,1,ar,"If everyone sheds the Arab politicians in the Saram, with something very good, at least they would know their value to the people  "
1496,1496,445,ูู ูุง ุญุฌู ููู ููู ุจูุชูู ุงูู ุงูุชุตุฑ ุจ ุณูุฑูุงุ ุงููู ุงูุชุตุฑูุง ุชูุจุดููุุจุงุณุชุซูุงุก ุงูุดุนุจ ุงูุณูุฑู,0,ar,"For you, Haji, who told you Putin, who won Syria? Everyone has won me, except for the Syrian people  "
1497,1497,759,ุนูุฏูุง ุชุจุงุน ุงูุฃุญุฐูุฉ ุฎูู ุงูุฒุฌุงุฌ ูู ูุญูุงุช ูููููุ ุจูููุง ุชุจุงุน ุงููุชุจ ุน ุงูุฃุฑุตูุฉุ ุนูุฏูุง ุชุณุชุจุฏู ุงูุนููู ุจุงูุฃุฑุฌู ูุนูู ุงูุจุดุฑ ุงูุณูุงู โฆ,0,ar,"When shoes are sold behind the glass in air-conditioned stores, while books are sold on sidewalks, when minds are replaced by legs, humans must be peace ...  "
1498,1498,4022,ูุญุชุฑู ูู ุงููุดุงูุฎ ุงูุงุฌูุงุก ูููู ุงูุช ููู ุจุนุฏ ุจูุญุชุฑูู ุนูู ูุนุจ ุฏูุฑู ุงููุชูุงูู ุฏุงุฎู ุงูุทุงุฆูู ูุดูุฑุง,0,ar,"We respect all evident sheikhs, but you are still respectful of you for playing your fatwa role within the sect. Thank you  "
1499,1499,3125,ุทุฒ ุจููู ุฏููุฉ ูุงูู ุทุฒ ุจุงูุญุฑูุฑู ุงููุงุณุฏ,1,ar,Tz Bahik state and a thousand Tz Hariri rotten  
1500,1500,1200,ูุง ุฃูุช ููุง ุนุชูุงู ููุง ููุงุณ ููุง ุงุฑุณูุงู ููุง ุฌูุจูุงุท ููุง ุจุฑู ููุง ุงูุญุฑูุฑู ููุง ุจุงุณูู ุฌุนุฌุน ูุฑูุฌูู ุงูุฌููู ุนูู ุฌุฑโฆ,0,ar,"Neither you, Atman, Class, Arslan, Jumblatt, Berri, Hariri, Basil Geagea, Franjieh, Aoun Jarr ...  "
1501,1501,872,ุฎูููู ููููู ุงูุชู ูุซููู ุจููุฑููุง ุงููููุจูู ู ุงููุญุฌุจูู,0,ar,"Come here, you just hate veiled prospectors  "
1502,1502,2952,ุงูุฏูุน ููุงุจู ุงููุจุงุญ ุนูู ุฌุจุฑุงู ุจุงุณูู,0,ar,Pay for barking on Gebran Bassil  
1503,1503,636,ููู ููุถุงุก ูุชุฑุฃุณู ูู ูุชุฑุฃุณ ุนุซูุงู ุงู ูุญุงุณุจู ุงููุณุงุฏ ูุบุทููู,0,ar,"How can a judiciary headed by Osman preside over corruption, who will be held accountable by corruption?  "
1504,1504,1393,ููุงุก ุจุดุงุฑ ุงูุงุณุฏ ูุถุฑ ุจุงูุตุญุฉ,0,ar,Bashar al-Assad meeting harmful to health  
1505,1505,1237,ููู ุจุชูุฒูููุง ูู ุฏูู ุฏูููุ ุงู ุฎูุต ุงุฐุง ุงูุญููู ุงุดุชุฑุงูุง ููุบุถ ุงููุธุฑ ุ,0,ar,How do you download it without evidence? Or concluded if the ally bought it from sight?  
1506,1506,739,ุฐูุฑูู ูู ุดูุฑูู ูุน ูู ููุช ู ูู ููุช ุนู ุชุชูู ุฎููู ุฑุฌุงู ู ุงุซุจุช ุนูู ูููู,0,ar,It reminded me two months ago with whom you were and who you were accusing of being men and holding on to a situation  
1507,1507,200,ููุงุจ ุบูุงุจ ุณูุฑูุง ุนู ุงูููุฉ ุงูุนุฑุจูุฉ ุงููุฏูุง ุงูููุชูุง,0,ar,Syria's absence from the Arab Summit has fueled its loss of importance  
1508,1508,394,ูุฐุง ุงููุดุฑูุน ูุนุชุฏู ุนูู ุงูุฃููุงู ุงูููุฑูุฉ ูู ููุทูุฉ ุฏุงุฑูุง ูุฏูู ุฃูุฉ ุฑุฎุตุฉ ุณูู ุชุดุจูุญ ุนูุงุฏ ุนุซูุงู ูุฐุง ุฃุทุงูุจ ุงูุฑุฆูุณ ุนูู ุงุจุฑุงููู ุจุงูุชุฏุฎโฆ,0,ar,"This project attacks the river property in the Daraya region and without any license other than Thabitha Imad Othman, so I call on President Ali Ibrahim to smoke ...  "
1509,1509,1438,ูุฏูู ุตูู ูุนูู ูู ุงูุจุดุฑ ูุง ุจููุฏุฑ ูุงุฎุฏ ูููู ูู ุฌุฑููุฉ ุงูุง ุงุฐุง ุนุฑู ููู ุนูููุง ูุญุณุจ ุงููุฌุฑู ุจููู ุงููููู,0,ar,"The point of a certain type of human being cannot take a position on a crime unless he knows who its work is, and according to the criminal, the position is  "
1510,1510,2280,ููู ููุง ูุฐุงุจ ููุงุฌุฑ ูุจุงุจูุฌู ุฃูุถู ูู ูุญูุฉ ุญุณู ุงูุจูุง ูุงูุฑุฏูุบุงู ุงููุงุณููู ูุชุนูุฏ ุงูุดุฑู ุงูุฃูุณุฎ ุงูุฌุฏูุฏ ููู ูุนุฏ,1,ar,Cole Hoa Liar and Evil and Babugi are cleaner than Hassan Al Banna's Beard and Erdogan Freemasonry the Undertaker of the New Dirt but Promise  
1511,1511,1749,ูุง ูุญุฑู ุงูุช ุฏุฎูู ุนูููู ุจุณ ุจุชุดูู ุจุนูู ูุญุฏุฉ ูููู ูู ูู ุงูุชุนุฏูุงุช ููู ุจ ุญู ุงูุณูู ููุณูุฑูู ุงูููุฑ,0,ar,"O Muharram, you enter your eyes, but you see with an eye for unity, and where are you from all the aggressions?  "
1512,1512,2384,ุฌุจุฑุงู ุจุงุณูู ูุตู ุฌุจูุชูู ูููููููููู,0,ar,"Gebran Bassil, bombing your front hahahahahaha  "
1513,1513,2199,ููู ุจุชุญุจ ุชุฌูุจ ุงูุจูุฏูุฉ ูุญุงูู,0,ar,Why do you like Bhdla answer you  
1514,1514,1791,ููู ููุง ุงูุช ููุนู ุฒุงูุฏู ูุณููุงูู,1,ar,"Cole Hua, you curse your Zayed and Salman  "
1515,1515,2262,ูุด ููููู ุฌูุจูุงุทู ุฏุฑุฒู ุจุงูุฃูู,0,ar,It is not your Jumblatt will be Druze at first  
1516,1516,735,ูุฐุง ุชุฏุฎู ุณุงูุฑ ูู ุนูู ูุงุนูุงูู ูู ุงูุทุงุฆูู ุงูุชูุญูุฏูู ููู ููุณ ุงููุจุฏุฃ ููุงุฐุง ูุง ูุฏุนู ุนูู ุงูุงููู ููุงูุฑ ุญููุฏ โฆ,0,ar,"This is a blatant interference from Aoun and his aides in the monotheistic sect, and from the same principle as to why Ali Al-Amin and Maher Hammoud are not called ...  "
1517,1517,1519,โูุฌุจุฑุงู ุจุงุณูู ุฅู ุฐุจุญ ุ ููู ุจุฐูุงุฆู ูุญููุชู ูููุงุฆู ุงููุทูู ููุจูุงู ุงูููุญูุฏ ุจุฌููุน ุทูุงุฆููโฆ,0,ar,"And Gibran Bassil, if slaughtered, is because of his intelligence, sophistication, and absolute loyalty to a united Lebanon in all its sects ...  "
1518,1518,1638,ุงููู ูููู ูุงูุทุงุฆูุฉ ููุจุงุฑู ุจุฑุฌุงููุง ุงูุฃุญุฑุงุฑ ููุดุงูุฎูุง ุงูู ููุดูู ุญุงููุง ูููู ูุทูู ุนูุฑู ูุนูุฑู ูุนุงูู ุงููุฒูุฑ,0,ar,"God strengthens this sect and blesses its free men and our sheikhs, as long as we are in a situation where they will extend your life and the life of His Excellency the Minister.  "
1519,1519,3983,ูู ูุงุญุฏ ุจู ุงูููุณูู ูุงุทุฑููู ูุทูุน ูู ุงูุนุตููุฑูุฉ ุจู ูู ููููู ุงูุดุงููู,0,ar,"In one of me, Mexico, Natrino, emerges from Asfouriya, are you two days inshallah?  "
1520,1520,2703,ุงูุจูุงู ุงูุฎุชุงูู ููููุฉ ุงูุนุฑุจูุฉ ูุชููู ูุฒูุฑ ุงูุฎุงุฑุฌูุฉ ุฌุจุฑุงู ุจุงุณูู,0,ar,The final statement of the Arab Summit is read by Foreign Minister Gibran Bassil  
