,Unnamed: 0,Unnamed: 0.1,text,label,lang,translated
2130,2130,774,ุงูุช ุจุชุนุฑู ูุง ุฃุณุชุงุฐ ูุงุฏู ุงูู ูุจูุงู ุงุญูู ุจูุฏ ุจุงูุนุงูู,0,ar,"You know, Professor Fadi, that Lebanon is the most beautiful country in the world  "
2131,2131,133,ููุงุจ ูุน ุงูุญูููุฉ ุงูุฌุฏูุฏุฉ ูุฌุจ ุฃู ูููู ููู ุฅูุงูุฉ ุงูููุงุก ุนุซูุงู ุนูู ุงูุทุงููุฉ ูุจูุงู,0,ar,"Wahab with the new government. The sack of General Osman should be on the table, Lebanon  "
2132,2132,1401,ูููุฉ ุงูุญูุฏ ุงูู ุนูุฏูู ุจุชุฑุถุนููุง ุจุญููุจ ุงููุงุชูู ุถุฏ ุงูุญุฑูุฉ,0,ar,The amount of hatred you have by breastfeeding your mothers' milk against movement  
2133,2133,2021,ุฌุจุฑุงู ุจุงุณูู ุนุงู ูุง ุนูุง ูุดููุฉ ุงูุฏูููุฌูุฉ ูุน ุงุณุฑุงุฆูู ูู ุญููุง ุชุนูุด ุจุณูุงู,0,ar,Gebran Bassil General We have no ideological problem with Israel. It has the right to live in peace  
2134,2134,1557,ูููู ูุชูุฑ ุฃุนุทููู ูุงุญุฏ ูุซู ุฌุจุฑุงู ุจุงุณูู ูุณุฃุฌุนู ุงูุฑูุจุง ุชุฒุญู ุชุญุช ุงูุฏุงูู ูู ุงูุฌูุน,0,ar,Hitler says give me one like Gibran Bassil and I will make Europe crawl under my feet from starvation  
2135,2135,2220,ุฌุจุฑุงู ุจุงุณูู ูุงูุฆ ุงูุฏููุง ูุดุงุบู ุงููุงุณ,0,ar,Gibran Basil is the worldโs concern and the peopleโs concern  
2136,2136,3560,ุดู ุฃุดุจู ุณุนูุฏ ููุฑุฒุง ูุง ูููู ุ ูุง ููุช ุงูุช ูุบูุฑู ุจุฏูู ุฑุถุงู,0,ar,"What do you think about Mirza, Fahim? You and others would not like him  "
2137,2137,198,ูุจู ูุง ุชูุชุฑุญ ุดูู ููุณู ุนูู ุงููุฑุงูุง,0,ar,Before you suggest to look at the mirrors  
2138,2138,2509,ูู ูุงุฏุง ุจููุฏุฏ ูุงุฏุง ุจูุฏูู ุดู ุงููุตุฉ ูุงูู ุนุงุฑููู ูุงููุฑุงูุจูู ูุงุนุฏูู ุณูุงุญุฉ ุจุฑูู ุงูุฏูู ุฎุงููุง ุงููู ูุง ุนุฑุจ ูุง ุนุฑุจ ุฎุฐูุชููุง ุจุงุจ ูุจูู ุจูุฌูุฏ ุจุนุซุฉ ุงููุฑุงูุจูู ุงูุนุฑุจ,0,ar,"This is for you, this is my opinion. I want to tell you the story. We did not know, and the observers were traveling in the corner of religion. They feared God, Arabs, Arabs!  "
2139,2139,931,ุงูุนูุดุฉ ุจุชูุจููู ูุง ุณุช ุฏููุง,0,ar,"Living will make you happy, Dima  "
2140,2140,1178,ูุนูู ููุฏุง ุงูุดู ููู ุฅุณููุง ุฌุจุฑุงู ุจุงุณููุ ูู ุนูู ุดุบูุฉ ูุญุฏุฉ ูููุญุฉ ุจุญูู ุงููุทูุ ูู ูุตุฉ ุงูููุฑุจุงุ ููุจุงุณุจูุฑ ุงููุจูุงููุ ูู ุนูู ุญุงโฆ,0,ar,"I mean, this is something that follows the name of Gebran Bassil, if he had worked on a unit assigned to the homeland, from the story of electricity, to the Lebanese Baspor, if he worked ...  "
2141,2141,4114,ุงุณู ุงููู ุนููู ูุฑุฌููู ุนุฑุถ ูุชุงูู ูุง ูููู ุนูู ููุฑุฉ ุงุฐุง ูุง ุนูุฏู ูุฑุงูุฉ ุจุงูุจูุช ุจุจุนุชูู ูุญุฏุฉ,0,ar,
2142,2142,2035,ูุง ุนูุชุฑ ููู ุนูุชุฑู ุงูุนูุงุจ ูููุงุจ ููุงุจ ูุงุชู ุงุจู ุฏูุงุจ,0,ar,"Antar, who would you punish for Wahab Wahab, the assassin of Abu Diab?  "
2143,2143,64,ุฏุงุฆูุง ุงูุช ุนูู ุญู โค,0,ar,Always you are right โค  
2144,2144,2651,ููุงุชุฌู ุถุจุถุจ,0,ar,My forces are fog  
2145,2145,171,ูุฆุงู ููุงุจ ุงูุทุงุฆูู ุณุจู ููุตู ุงููุฑุฃุฉ ุงูุณุนูุฏูุฉ ุจุดูุงู ุงููุญู ููุฃุณู ุงูุฅูุงุฑุงุช ูู ูุนุฏโฆ,1,ar,"Al-Wahhab sectarian harmony previously described Saudi women, Shawal coal, unfortunately the UAE is no longer ...  "
2146,2146,1092,ูููููู ููุญู ูุนูู ูุณููุฑุง ููู,0,ar,"Good luck, we will support you  "
2147,2147,1196,ุฎูุตุช ุงูููุฉ ูุตุงุฑ ููุช ุงูุญูู,0,ar,"The summit is finished, and it is time to tell  "
2148,2148,3431,ุฌุจุฑุงู ุจุงุณูู ูุบุฑุฏ ุฎุงุฑุฌ ุงูุณุฑุจ ุงูุชุทุจูุน ูุน ุงูููุงู ุงูุบุงุตุจ ุฎูุงูุฉ ุนุธูู,0,ar,Gebran Bassil tweeted out of the swarm normalization with the usurping entity a great betrayal  
2149,2149,1838,ูุง ุจูุตูุฑ ูููุฉ ุนุฑุจูุฉ ูุน ุฌุจุฑุงู ุจุงุณูู ูุตูุญุฉ ูุง ุชุฌุฑุจููุง,0,ar,"What becomes Arab coffee with Gibran Bassil, an advice what you try  "
2150,2150,2272,ูุง ููู ุชุทูุจ ููู ุทูุจ ูุฃู ูุงุฒู ูุชุบูุฑ ุงุณู ุชููุชุฑ ูุงุณู ุฌุจุฑุงู ุจุงุณูู,0,ar,You do not want to ask for this request because the Twitter name must change to the name of Gebran Bassil  
2151,2151,1837,ููู ุจูุทููู ุงูุช ูุง ุญุจูุจู ุงูุฌูุงุนุฉ ุฏุนููุง ุงูุฏููุฉ ูุด ุณุนุฏ ุงูุญุฑูุฑู ุฎูุต ุณููุช,0,ar,"How do they kindle you, my dear, the group, support the state, not Saad Hariri, conclude Scott  "
2152,2152,2601,ููุฏู ุซูุงูุชูู ููู ุจุชููุฑูุง ุญุงููู ุดุงุทุฑูู ูููุง ูู ูุง ุญุฏุง ุฎุงูููู ุงูุฑุฃู ุจุชุชูููู ุจุงูุนูุงูุฉ ุงู ุงูุฎ,0,ar,"This is your culture. Think about your situation, sharing everything you have contradicted, accusing it of employment or so on.  "
2153,2153,1020,ุตุฏูุชู ุฏููุง ููู ููุงุณู ุงููุจูุงูููู ูู ุงูุซุฑ ุชุฎููุง ูุนูุตุฑูู,1,ar,"I always believe, but unfortunately the Lebanese are more backward and racist  "
2154,2154,1642,ูุฑูุฌูุฉ ุฃู ุงููุชุงุฆุจ ูุงูู ููุซูููู ุงูุฃูุซุฑูุฉ ุงูุณุงุญูุฉ ููููุงุฑูุฉ ุฃูุง ุงูุขู ููุง ููุซููู,0,ar,"Franjieh or the Phalanges represented the overwhelming majority of the Maronites, but now they do not  "
2155,2155,3076,ูุนูุงูุง ุงููุณูุญูุฉ ูุงุฌุญูู ุงูุชุฑ ูู ุงูุงุณูุงู ุนุงูุชุนุจูุฑ,0,ar,"Christianity means more successful than Islam, the term  "
2156,2156,2661,ููุงู ุตุญูุญ ูุจููุถูุนูุฉ ูู ุฏูู ุชููุถุน ูุชูุฌู ุณูุงุณู,0,ar,True and objective talk without positioning and political direction  
2157,2157,2968,ุฑูุญู ุงููุจุฑู ุงูุดุบูู ุจุดู ุนูุณุชูู ุชูููุฑู ุงูุฎุฑุง ูุชุฑูููุง ูู ุชูุธูุฑุงุชู ูููุณูุชู ูุง ุชุฏุฎูู ูููุง ูููุง ุนุงููุทุจุฎ,1,ar,"My soul, go ahead, get busy, do something good, and leave us with your theories and philosophy, do not enter us, and don't cook  "
2158,2158,3999,ุงูุฃุฑุฏู ุจูุช ููุชูู ุงููุณุฎุฉ ูููุช ุงูุญุฏูุฏ ุจุดูู ูุงูู ูุน ุฏุฑุนุง ุนุดุงู ูุง ูุฏูู ููุง ุนุณูุฑู ูุนุฏู ููุง ุญููุฉ ุงููุธุงู ุชุจุฏุฃ ุงูุฃุฑุฏู ูุงูุง ุนุทูุช,1,ar,"Jordan, a dead girl, the dirty side, completely closed the borders with Daraa, because neither a civilian nor a military was preparing for what the regimeโs campaign began with Jordan.  "
2159,2159,335,ููู ููุฏ ูุงูุฑูู ูุงู ููุดูู ุนูู ุนููุฏ ุฑูู ู ุจูุชููููุฉ ูุฒูุฑ ุฎุงุฑุฌูุฉ ู ุงูุณูุทุงู ูุงุจูุณ ูุงู ุงูุณูุทุงู ูุงุจูุณ,0,ar,"On the day Macron was born, Michel Aoun was a colonel corner and Bouteflika, a foreign minister, and Sultan Qaboos was Sultan Qaboos  "
2160,2160,110,ุงุฎุฑุณ ูุง ุฃููุง ุงููุฌุณ ุงูุฎูุฒูุฑ ุงูุฏููุซ ุงูุช ูุจุดุงุฑ ุงููููุงูู ูุญุฒุจ ุงูุดูุทุงู ูุงููุฌูุณ ุฅูู ูุฒุจูุฉ ุงูุชุงุฑูุฎ,1,ar,"Shut up, you unclean pig cuckold, you, Bashar al-Chemical, Satanโs party and the Magi to the dustbin of history  "
2161,2161,2739,ุงููุจุฑ ุงุญุชุฑู ุญุงูู ูุง ูุงุทู ูุงุบุจู ูุงูุจู ูู ุงูุนูููุฉ ูุง ูู,1,ar,"Destroy, respect you, O watti, stupid and asshole of the awn, what is in  "
2162,2162,3522,ุงูุง ุจุฑุฃูู ููุงู ูุฑุตู ุงูุขู ููุฐูุจ ุจุงูุทุงุฆูู ุฅูู ุจุฑ ุงูุฃูุงู ุจูุฌูุฏ ุชูุงูู ุฏุฑุฒู ุนููู ูููููู,0,ar,"In my opinion, there is an opportunity now to take the sect to safety, with a Druze consensus that they may understand  "
2163,2163,3971,ูููุง ูุนุฑู ููู ุงููุฑุฌุน ุงููุจูุฑ ูุนุงูููุุุ,0,ar,Do we know who the great reference is your Excellency ???  
2164,2164,505,ูุง ุงุฎู ูููุงูู ูููู ูููุณู ุนูู ุณูุฑูุง ุจุชููุฑ ุจูุฒูู ุทุงูุน ูุงุฒู ุนูู ุงูุทุฑูู ูุจุชููุฑ ุชูููููุงุช ููุงูุณุงุช ุงููู ูุจุงุฑููโฆ,0,ar,"My brother, we said, we tell your souls about Syria, with the availability of petrol, go down on the road, and with telephones and faxes, God bless.  "
2165,2165,3619,ูุงุฎู ุงูุง ุจูุฑู ุงูุจูุงุช ูุฑู ุงูุนูู,1,ar,"My brother, I hate girls, hate uncle  "
2166,2166,3732,ุนุฌุจุงู ูููู ูุง ููููู ุงูุชูููุฒ ุจูู ุงููุญุณู ูุงููุณุชุบู,0,ar,A wonder to a people who cannot distinguish between the benefactor and the exploiter  
2167,2167,1711,ุจูุนุฒู ุนู ุฃุฏุงุก ุจุนุถ ููุงุตุฑูู ูุง ุณููุง ุนูู ูุณุงุฆู ุงูุชูุงุตู ุงูุฐูู ูุณุงูููู ุนู ูุตุฏ ุฃู ุบูุฑ ูุตุฏ ูู ุงุฒุฏูุงุฏ ุงูุดุฑุฎ ู ู,0,ar,"In isolation from the performance of some of his supporters, especially on the media, who contribute intentionally or unintentionally to the increase in cracking and AD  "
2168,2168,2411,ุชุณูููู ุงูุช ูุงููููุฐุฌูู ุงููุดููู ุงูู ูุญู ุงูุดูุนู ูุจูู ูุฏูุน ุซูู ุจูุงุก ุบูุฑูุง ูุณูุช ุงูุช ูุบูุฑู ุงุจูุงุก ุดูุฏุงุก,0,ar,"You accept, and the typical problem is that we Shiites keep paying the price for the survival of others. You and others forgot the children of martyrs.  "
2169,2169,2684,ุฏุฑุฌุงุช ูุชูุงูุชุฉ ุจุงููุตูุตูุฉ ูุง ูุนูู ุฅู ุงูุจูุฏ ุฎุงูู ูู ุงููุตูุต ููู ูุนูู ุฅู ููุงู ูุตูุต ูุจุงุฑ ูุจุงุฑ ููุตูุต ุฃุตุบุฑ,0,ar,"Different degrees of thievery does not mean that the country is free of thieves, but it means that there are big old thieves and smaller thieves.  "
2170,2170,1802,ูุฆุงู ุจูุนุทู ุดูุงุฏุงุช ุจุงููุณุงุฏ ุงูุนูุงุจ ูููุงุจ ููุงุจ ูุงุชู ุงุจู ุฏูุงุจ,0,ar,Weam sale of certificates of corruption punished Wahhab Wahhab Abu Diab's murderer  
2171,2171,1683,ุตุฏูุชู ุญุงูู ููุจู ุงููู,0,ar,My honesty are you all  
2172,2172,3020,ูุงุนูู ุงู ุงูุนุฏูุฏ ูู ุงููุจูุงูููู ูุนูููู ูููุงูุงุฑุฌูู ุนุงุฏู ูู ุดุฆุช ุงูุง ูุจูุงู ุงูุฑุณูู ููุง ูุณุชุทูุน ูุนุงุฏุงุฉ ุงุญุฏ ุณูู ุงูููุงู ุงูุตููููู,0,ar,"And I know that many Lebanese work there, so I hope you are normal for whatever you want. As for the official Lebanon, it can only hostility to the Zionist entity.  "
2173,2173,2663,ุดู ุงูููุน ูููู ูููุง ุจูุงูุจูุฏ ุฅูุฏ ูุญุฏุฉ ุจุณ ูู ุฃุตุจุน ุถุฏ ุงูุชุงูู,0,ar,"What is the benefit? We are all in the country, I want unity, but every finger is against the other  "
2174,2174,2901,ูุด ุนู ูููู ุนููู ูุงูุงูุงู ุงูุนูุงุจ ูููุงุจ ููุงุจ ูุงุชู ุงุจู ุฏูุงุจ,0,ar,"We do not understand the punishment for you, Wahab Wahab, the assassin of Abu Diab  "
2175,2175,2369,ููุตู ุงููุงุณู ุฃูุช ุฏุฑุฒู ููุชุงู ูุงูุขู ุจุฏุฃุช ุงููุชูุฉ ุนูู ุงูุฃุฑุฏู ุณุฏ ุจูุฒู ูุงุณูุช,1,ar,"Faisal Al-Qasim, you are a Druze and a sedition, and now the strife has begun on Jordan, the Buzak Dam and the silence  "
2176,2176,506,ุนุงุณุงุณ ุงูุช ูุงุญุฏ ูููุงู,0,ar,You are one understanding  
2177,2177,1315,ุงูุนุงุฑ ูู ุงูุนุงุฑ ุฌูุงุนุฉ ุงูุฏุฌุงููู ูุฆุงู ูุทูุงู ู ูุงุตุฑ ุงูุฏูู ููู ูู ูุญุงูููู ููุฏุนููู ุ ููุฒูุฉ ุงููุฌุชูุน ููุฒูุฉโฆ,1,ar,"Shame, all shame, the community of quacks, harmony, Talal, Nasir al-Din, and everyone who is close to you and supporting you, the farce of society is a farce ...  "
2178,2178,3543,ูุง ูุงููู ููุนูู ูููุนู ุชุฑููุง ู ุฑูุณูุง ู ุงูุฑุงู ูุง ุงุฑูู ุงููุงุน ุงูุทุดู ู ูู ุจุนุฏ ุงูุนููู ุทุดู ููุนูู ูุญุชู,1,ar,"No, and God curse you and curse Turkey, Russia, and Iran, oh the finest kind of tashm, and is after the upper tashm, an occupier curse you?  "
2179,2179,3085,ุจุณ ููุถูู ูุชูุฑ ุจุถุญููู ุณููู ุฎุงุตุฉ ุจุณ ูุญุงูู ูุนูู ุฒููู,0,ar,"But I was so indigestible that Celo laughed at me, but he tried to do my work  "
2180,2180,503,ููู ุตุงุฑุช ูุฐูุฑุฉ ุงูุฌูุจุ ุนู ูุชูููู ุงูู ูุงุฑ ูู ูุฌู ุงูุนุฏุงูุฉุ ุจุดุฑูู ูุด ุทูุจูุง ููู ุชููู ูุฌููู ุนู ูุถุงุก ููุดููู ููู ุจุฏู ูููููููู ูุงูุง ุ,0,ar,"Where did the fetch note become? If they accuse you of escaping from justice, with your honor, they have not asked you to stop your attack on the Lishofu district.  "
2181,2181,644,ูุฌุจ ุฃู ุชุนูู ุตุญูุญ,0,ar,It must circulate properly  
2182,2182,2298,ุฑุจ ุถุงุฑุฉ ูุงูุนุฉ ูุตูู ุฌุจุฑุงู ุจุงุณูู ุงูู ุงูุฑุฆุงุณุฉ ูุนูู ุงููุง ูุตููุง ุงูู ุญุงูุฉ ุงูุงุญุชุถุงุฑ ุงููุงูู,0,ar,"Lord, harmful and beneficial, the arrival of Gibran Bassil to the presidency means that we have reached a state of complete death  "
2183,2183,3038,ููุงุจ ูุง ูุดุฑ ูู ุฌุฑูุฏุฉ ุงูุฃุฎุจุงุฑ ุงูููู ููู ุฏููุฉ ุชุญุชุฑู ููุณูุง ูุณุชุฏุนู ุชูููู ููุฑู ูุนูุงุฏ ุนุซูุงู ูุฒุฌู ูู ุงูุณุฌู,0,ar,Wahhab what was published in Al-Akhbar newspaper today and in a self-respecting country calls for the immediate arrest of Imad Othman and sent him to prison  
2184,2184,468,ุฌูุงุฑุฉ ุจุจุฑูุทุงููุง ูุงููู,0,ar,"Djkara, Britain and God  "
2185,2185,128,ุงูุงุณูุฏ ููุญุฑููุงุชุุงูููุดู ูููู ุจู,0,ar,"Black for women, Fushi befitting me  "
2186,2186,3288,ูุงูุงูุงูุงูุงูุงูุง ูุง ุณูุฏู ูุงุฏูุฑู ูุฑู ููู ุนูููุงู ูุฎุงูุฉ ุงูุฑุฆูุณ ุนูู ูุญููุฉ ูููุฏุณ ุงูุนูุฏ ุฌุจุฑุงู ุจุงุณูู ูููุฉ ุญู,0,ar,
2187,2187,2620,ูุง ุซูุฉ ุจูู ุงูุนุฑุจ ุฃุฐุง ููุณุทูู ูุจุงุนููุง,0,ar,There is no trust in all Arabs if they sell and sell Palestine  
2188,2188,1869,ุฃููุง ุจุนุฏ ุจููุฑ ุนูู ูู ุญุฏูุซ ุซุงููุง ุงููู ูุทูู ุจุนูุฑ ูุฎุงูุฉ ุงูุฑุฆูุณ ุงูุนูุงุฏ ููุดุงู ุนูู,0,ar,"First, after Bakir Ali, is the hadith secondly, God extends the life of His Excellency President General Michel Aoun  "
2189,2189,1231,ุงููุงุช ุจุญุณุณูุง ุฌุจุฑุงู ุจุงุณูู ุงูู ูู ุงูู ุงูุณุงู ูุจุท ุนูู ุณุทุญ ุงูููุฑ ุจุฏุนู ูู ุงูุนูุฏ ุงูุฌุฏูุฏ ุงูููู ูุจูุงู,0,ar,"At times, we felt Gebran Bassil Anou was the first person to land on the moon with the support of the powerful New Testament Lebanon  "
