,Unnamed: 0,Unnamed: 0.1,text,label,lang,translated
2981,2981,2153,imagina tão mostrando a família do cara no bbb dai a mãe dele ta com um cartaz 'seu pai morreu semana passada :(',0,pt,"imagine showing the family of the guy on the bbb, so his mother has a sign 'your father died last week :('  "
2982,2982,2633,mesma firma onde ouvimos 'se eu contratar alguém feia e gorda pro atendimento o [insira aqui o nome do dono] me mat _ https://t.co/tKLcjfEKBs,0,pt,same firm where we hear 'if I hire someone ugly and fat for the service [insert the name of the owner here] mat _ https://t.co/tKLcjfEKBs  
2983,2983,978,Convida nui de Sampa! RT @HTColorido    Vamos p uma baladinha em sampa??? @fabsramos @LiviaCastroFoto @tiaglopes @brunomatos e Lucas,0,pt,Invites Sampa's nui! RT @HTColorido Let's go for a party in sampa ??? @fabsramos @LiviaCastroFoto @tiaglopes @brunomatos and Lucas  
2984,2984,1143,Dia desses apareceu uma propaganda aqui na minha TL sobre trans serem versões piratas de mulher e eu fiquei apenas 'wtf' gente burra,0,pt,The other day there was an advertisement here on my TL about trans being pirated versions of women and I was just 'wtf' dumb people  
2985,2985,2752,"Mulher burra mano! Em vez de mandar a porra do comprovante pra mim, manda pro diretório acadêmico do caralho da UNT!",1,pt,"Stupid woman bro! Instead of sending the fucking voucher to me, send it to the fucking UNT academic directory!  "
2986,2986,3548,"Porra, que lixo, que idiotas... o mundo está à deriva... https://t.co/TFnnrQlqzj",1,pt,"Damn, what rubbish, what idiots ... the world is adrift ... https://t.co/TFnnrQlqzj  "
2987,2987,2703,"MINUTO A MINUTO CAMAROTE GLACIAL JOAQUIN TEIXEIRA:
16:04 SARGENTO FAHUR REVISTA FÁBIO ASSUNÇÃO
16:06 ALEXANDRE BORGES BRIGA COM PAPARAZZI",0,pt,MINUTE TO MINUTE CAMAROTE GLACIAL JOAQUIN TEIXEIRA: 16:04 SERGEANT FAHUR MAGAZINE FÁBIO ASSUNÇÃO 16:06 ALEXANDRE BORGES FIGHTS WITH PAPARAZZI  
2988,2988,1509,@Estadao que legal esse proselitismo barato sobre muçulmanas. Vamos falar sobre mutilação vaginal também? Falta de direitos no Islão?,0,pt,@Estadao how cool this cheap proselytism about Muslim women. Shall we talk about vaginal mutilation as well? Lack of rights in Islam?  
2989,2989,927,"Como diria o Apóstolo Alexandre, bem-aventurados aqueles que, não tendo dinheiro, têm amigos para os livrarem da usura do crédito bancário.",0,pt,"As the Apostle Alexander would say, blessed are those who, having no money, have friends to free them from the usury of bank credit.  "
2990,2990,3714,"Que grande retorno e vitória dos Patriots. Tom Brady, Bob Kraft e Coach B são verdadeiros campeões. Nossa! https://t.co/lRFnP19NKz",0,pt,"What a great return and victory for the Patriots. Tom Brady, Bob Kraft and Coach B are true champions. Wow! https://t.co/lRFnP19NKz  "
2991,2991,5218,"Sportinguistas,hj n se esqueçam de votar Bruno de Carvalho.
O mundo d futebol e principalmente o mundo da comédia,precisam de + 4 anos disto",0,pt,"Sportinguistas, today don't forget to vote for Bruno de Carvalho. The football world and especially the comedy world, need + 4 years of this  "
2992,2992,3906,RT @Adolfo_Dias_I: Não há cozido à portuguesa que não tenha farinheira nem greves na Função Pública que não sejam à sexta-feira...,1,pt,RT @Adolfo_Dias_I: There is no Portuguese stew that does not have flour or strikes in the Civil Service other than on Friday ...  
2993,2993,3563,"Por um mundo com mais:
#MeuAmigoSecreto
#NãoÀCulturaDoEstupro
#FeminicídioNão
#NenhumaAMenos
Celebremos o #DiaInternacionaldaMulher.",0,pt,For a world with more: #My Secret Friend # No ÀCulturaDoEstupro # Feminicídio Não #NomaAMAMenos Let us celebrate the #InternationalDay of Women.  
2994,2994,5002,sai ow não sou tuas nega,1,pt,come out ow I'm not yours deny  
2995,2995,1843,"Fuleco é nome de traficante. Tipo 'Jair Cláudio da Rocha Maciel, o Fuleco'",0,pt,"Fuleco is the name of a drug dealer. Type 'Jair Cláudio da Rocha Maciel, the Fuleco'  "
2996,2996,3010,nunca vou conseguir emagrecer vou ser sempre essa gorda feia e fracassada,1,pt,I will never be able to lose weight I will always be this ugly and unsuccessful fat woman  
2997,2997,2802,"Na internet:
#SomosTodasPutas
Na vida real:
Não me chame de puta! Isso é machismo! Mimimi",1,pt,On the internet: #SomosTodasPutas In real life: Don't call me a bitch! This is machismo! Mimimi  
2998,2998,3882,"RT @_carmeloneto: Se as eleições fossem hoje, e o 2º turno fosse entre João Dória e Jair Bolsonaro. Em quem você votaria para presidente?",0,pt,"RT @_carmeloneto: If the elections were today, and the 2nd round was between João Dória and Jair Bolsonaro. who would you vote for president?  "
2999,2999,3465,"@perryoutside @RachelSherazade @joicehasselmann Não é rotulo, é mais uma diferenciação..ja que nao posso compara-la _ https://t.co/eh4JYdj9zY",0,pt,"@perryoutside @RachelSherazade @joicehasselmann It's not a label, it's more of a differentiation ... since I can't compare it _ https://t.co/eh4JYdj9zY  "
3000,3000,3031,"O #BlocoEsquerda, ponta-de-lança na cultura de morte, quer agora legalizar a Eutanásia.
Por mim defendo a Vida e sua dignidade.
@EsquerdaNet",0,pt,"The #BlocoEsquerda, a spearhead in the culture of death, now wants to legalize Euthanasia. For me I defend Life and its dignity. @Left  "
3001,3001,3562,Por um 8 de março em que eu não sinta que estou gorda e feia porque peso mais que 60 Kg,0,pt,
3002,3002,2896,"Não somos fufas, nada a ver, somos fofas https://t.co/vZEWgzbDgU",0,pt,"We are not fufas, nothing to do, we are cute https://t.co/vZEWgzbDgU  "
3003,3003,4075,"RT @Caleira94: 3700 adeptos para ver o Benfica na Alemanha , QUE LINDO É VERMELHO E BRANCO!",0,pt,"RT @ Caleira94: 3700 fans to see Benfica in Germany, WHICH BEAUTIFUL IS RED AND WHITE!  "
3004,3004,4338,RT @gustavozelele: E ai clã https://t.co/Cvq3lwzVU3,0,pt,RT @gustavozelele: Hey clan https://t.co/Cvq3lwzVU3  
3005,3005,1770,Feministas ou sindicatos vão lá protestar?? https://t.co/ns1bcccmYO,0,pt,Are feminists or unions going to protest? https://t.co/ns1bcccmYO  
3006,3006,4074,"RT @calabresadani: Num mundo com tanta dor,violência e injustiça, me orgulho por ter um marido e tantos amigos talentosos q se esforçam p f _",0,pt,"RT @calabresadani: In a world with so much pain, violence and injustice, I am proud to have a husband and so many talented friends who work hard  "
3007,3007,1655,Exemplo: Nizan Ganaes é um Bundão.,0,pt,Example: Nizan Ganaes is a Big Ass.  
3008,3008,3133,O Jorge Jesus acusou mesmo o regresso do Kelvin ao Porto,0,pt,Jorge Jesus even accused Kelvin of returning to Porto  
3009,3009,5104,Seria uma pena http://t.co/DmfI0kboqw,0,pt,It would be a shame http://t.co/DmfI0kboqw  
3010,3010,966,"conhece três cores: azul, vermelho e amarelo.",0,pt,"knows three colors: blue, red and yellow.  "
3011,3011,1456,"ESSAS FÃS DE FITFI HARMONY CAMILA CABELLO SÃO TUDO RETARDADA PAI AUSENTE, E FICAM SE ESFREGANDO A PERERÉQUINHA PRA APARECER, TÁ NA MODA
#PAZ",1,pt,"THESE FITFI HARMONY CAMILA CABELLO FANS ARE EVERYTHING RETARDED FATHER AWAY, AND GET RUSHING THE PERERÉQUINHA TO APPEAR, IT'S IN THE #PAZ FASHION  "
3012,3012,3273,"Os portugueses devem muito a Passos Coelho por ter tido a coragem de dizer NÃO a Salgado. 'NÃO stresses, Ricardo, leva o guito pró Panamá.'",1,pt,"The Portuguese owe much to Passos Coelho for having the courage to say NO to Salgado. 'NO stress, Ricardo, take the lead to Panama.'  "
3013,3013,544,"A SUZANE RICHTOFEN FOI SOLTA NO DIA DOS PAIS.
A JUSTIÇA É INCOERENTE: DEVIA TER SOLTADO O BRUNO NO DIA DOS NAMORADOS, E NÃO NO CARNAVAL.",0,pt,"SUZANE RICHTOFEN WAS RELEASED ON FATHER'S DAY. JUSTICE IS INCOHERENT: THE BRUNO SHOULD HAVE BEEN RELEASED, NOT ON CARNIVAL.  "
3014,3014,4568,RT @marisa_lobo: @Agenda #Abril. Seminário sobre Ideologia de Gênero.(Com certificado) 08 e 09 Abril. #Ariquemes/RO. https://t.co/9FWPfwGNRv,0,pt,RT @marisa_lobo: @Agenda #Abril. Seminar on Gender Ideology (with certificate) 08 and 09 April. # Ariquemes / RO. https://t.co/9FWPfwGNRv  
3015,3015,3545,"porra!! é difícil refutar o que falei com fatos, lógica e verdades? https://t.co/xceKmqNOCr",0,pt,"fuck!! is it difficult to refute what I said with facts, logic and truths? https://t.co/xceKmqNOCr  "
3016,3016,655,"BLOG: O dream team do futebol feminino vestia vermelho, branco e preto https://t.co/3QuyXLmHXV #Tricolor",0,pt,"BLOG: The women's soccer dream team wore red, white and black https://t.co/3QuyXLmHXV #Tricolor  "
3017,3017,1388,"E porque hoje é quinta-feira, a RTP decidiu entrevistar o Cavaco. Serviço público seria, pelo menos, respeitarem a memória de Zeca Afonso...",0,pt,"And because today is Thursday, RTP decided to interview Cavaco. Public service would at least respect Zeca Afonso's memory ...  "
3018,3018,2637,"Meu apoio Total ao Pastor Silas Malafaia, que está sendo mais uma vez, vitima dessa mídia comprada pela esquerda!",0,pt,"My total support to Pastor Silas Malafaia, who is once again being a victim of this media bought by the left!  "
3019,3019,2163,"Indo a Charleston, Carolina do Sul pra passar um tempo com a Boeing e falar sobre empregos! Ansioso. https://t.co/19L22J6oAj",0,pt,"Going to Charleston, South Carolina to spend time with Boeing and talk about jobs! Anxious. https://t.co/19L22J6oAj  "
3020,3020,3785,racismo está nos olhos de quem vê,0,pt,racism is in the eye of the beholder  
3021,3021,3183,O nosso regresso está mesmo prometido @18Jotta https://t.co/CFw1Uvu0LF,0,pt,Our return is really promised @ 18Jotta https://t.co/CFw1Uvu0LF  
3022,3022,41,"A avaliar pela quantidade de malta conhecida que morreu em 2016, o 'In Memoriam' deste ano é coisa para durar umas 9 horitas na boa
#Oscars",1,pt,"Evaluating by the amount of known malta that died in 2016, this year's 'In Memoriam' is something to last for about 9 hours in good #Oscars  "
3023,3023,753,"@CaioPerez2 Mano tô rachando o angola, falando que não quer pega a Maria Rita! Kakakaka Se acredita",1,pt,"@ CaioPerez2 Mano I'm splitting Angola, saying he doesn't want to take Maria Rita! Kakakaka is believed  "
3024,3024,1892,"'Gay é expulso de casa por ser gay'
Eu fui expulsa mesmo sendo hétero,sem ter feito nada
O preconceito só é uma desculpe p/ a falta de amor",0,pt,"'Gay is kicked out of the house for being gay' I was kicked out even though I was straight, without doing anything Prejudice is just an excuse for the lack of love  "
3025,3025,203,AGORA SIM EU ASSUMO http://t.co/UzOwKrxdOy,0,pt,NOW YES I ASSUME http://t.co/UzOwKrxdOy  
3026,3026,564,'ativista dos direitos humanos'. https://t.co/78fHX2oTJw,0,pt,'human rights activist'. https://t.co/78fHX2oTJw  
3027,3027,4409,RT @Joao_Marcos865: #NaoAceitamosRefugiados A Imprensa preocupa-se tanto com refugiados mas nao lembra os cristaos perseguidos e mortos no _,1,pt,RT @ Joao_Marcos865: #NaoAceitosRefugiados The press is so concerned with refugees but does not remember the Christians persecuted and killed in the _  
3028,3028,3420,"PEÇA PRA ESSE DÉBIL MENTAL DEIXAR DE SER SEU MEU FÃ
#JoaquinResponde https://t.co/G8XzaOiFYl",1,pt,ASK FOR THAT WEAK MENTAL STOP BEING YOUR FAN #JoaquinRespons https://t.co/G8XzaOiFYl  
3029,3029,3020,"o argumento da retardada é mostrar que sabe ler.
Quero ver refutar o que falei com fatos, lógica e verdades! https://t.co/TzZ6WBlhPB",1,pt,
3030,3030,4046,RT @BolsonaroSP: Bancada 'feminina' aproveita dia int. da mulher para criar fundo com nome bonitinho para financiar o... ABORTO! Legal né? _,1,pt,RT @BolsonaroSP: 'Female' bench takes advantage of int day. to create a fund with a cute name to finance the ... ABORTION! Cool huh? _  
3031,3031,5327,...ter ganho. Os democratas estão usando demais a mesma carta. Perderam as eleições e agora estão perdendo a noção _ https://t.co/D8AyuArvS6,0,pt,... have won. Democrats are using the same card too much. They lost the elections and are now losing track _ https://t.co/D8AyuArvS6  
3032,3032,4765,RT @rafaelasf7: Agora tá na moda colocar a culpa nos países do OM. Não se engane e aos outros.Quem produziu REFUGIADOS foram EUA e OTAN @Ab _,1,pt,RT @ rafaelasf7: It is now fashionable to place the blame on OM countries. Make no mistake and others. Those who produced REFUGEES were the USA and NATO @Ab _  
3033,3033,2392,"@lenabahirah Puts,o @CARPINEJAR não é gay... Legal a gente ver que as aparências enganam e não fazem a MENOR diferença. #namoradalinda",1,pt,"@lenabahirah Puts, @CARPINEJAR is not gay ... Nice to see that appearances are deceiving and do not make the slightest difference. #beautiful girlfriend  "
3034,3034,2557,"@MarleneBicalho Oi, cara-metade do desastre mor... dei umas fuçadas hj no blog!",0,pt,"@MarleneBicalho Hi, better half of the disaster ... I took a look at the blog today!  "
3035,3035,123,@adiosiago @amandassini quando branco acha que racismo é coitadismo só me dá mais vontade de continuar com o perfil,1,pt,@adiosiago @amandassini when white thinks racism is coitadism only makes me want to continue with the profile  
3036,3036,2113,Horas seguidas que quero te comer: quantidade de vagas para a libertadores,0,pt,Hours in a row I want to eat you: number of vacancies for liberadores  
3037,3037,5001,"Saindo da Flórida. Grande multidão de entusiastas fazendo fila na estrada, o que a mídia de NOTÍCIAS FALSAS se recu _ https://t.co/HIFiB5cgcu",0,pt,"Leaving Florida. Large crowd of enthusiasts lining up on the road, what the FALSE NEWS media recoils from _ https://t.co/HIFiB5cgcu  "
3038,3038,1744,Feliz #DiaDasMulheres pras verdadeiras guerreiras que trabalham ou cuidam do lar enquanto as vagabundas lutam pra abortar e andar pelada,1,pt,Happy #DiaDasMulheres for true warriors who work or take care of the home while the sluts struggle to abort and walk naked  
3039,3039,5210,sou um ser homossexual que só quer se dar com heteros porque as fufas ficam a lamber os dedos cheio de batata na minha frente.,1,pt,I am a homosexual being who only wants to get along with heteros because the fuffs are licking my fingers full of potatoes in front of me.  
3040,3040,3947,"RT @alex_borges: Você tem uma doença terminal e precisa deixar seus 3 filhos pequenos para alguém cuidar. Dessas opções, qual você escolhe?",0,pt,"RT @alex_borges: You have a terminal illness and you need to leave your 3 small children for someone to take care of. Of these options, which do you choose?  "
3041,3041,4826,"RT @rpsantos1970: Vamos lá a ver se entendi...
O PAN é a contra a eutanásia nos animais, mas a favor da legalização da eutanásia nos seres _",0,pt,"RT @ rpsantos1970: Let's see if I understand ... The PAN is against euthanasia in animals, but in favor of legalizing euthanasia in beings _  "
3042,3042,4982,@RuiHCruz Nem o nome da banda sabes. És uma fraude,0,pt,@RuiHCruz You don't even know the name of the band. You are a fraud 
3043,3043,5395,"Triste verdade que tantos teimam em não querer ver.
Quanto mais tarde se reverter a situação, mais difícil será. _ https://t.co/Qsfabbywwj",0,pt,"Sad truth that so many insist on not wanting to see. The later the situation is reversed, the more difficult it will be. _ https://t.co/Qsfabbywwj  "
3044,3044,5605,~*~*~*~ vOcÊ é NeGrA mAs AtÉ qUe é BoNiTa ~*~*~*~,1,pt,~ * ~ * ~ * ~ YOU ARE NEGRA MAs UNTIL IT'S BEAUTIFUL ~ * ~ * ~ * ~  
3045,3045,2090,"@homemdeverdade usa barba ou bigode, essa coisa de pelinha lisinha pra gente é bunda de mulher !",1,pt,"@homemdeverdade wears a beard or mustache, this smooth skin thing for us is a woman's butt!  "
3046,3046,5091,SEPARADOS POR 20 REAIS http://t.co/iq5CCRuKHR,0,pt,SEPARATED BY 20 REALS http://t.co/iq5CCRuKHR  
3047,3047,2814,"Não acredito que um juiz colocaria nosso país em tal risco. Se algo acontecer, culpe-o junto com o sis. legal. Estã _ https://t.co/ctA8G3dZjP",1,pt,"I do not believe that a judge would put our country at such a risk. If something happens, blame him along with the sis. cool. You are _ https://t.co/ctA8G3dZjP  "
3048,3048,779,@CapitalismoOP nem liga... pra esse povo mimizento....,0,pt,@CapitalismoOP don't even care ... for these cute people ....  
3049,3049,3541,"Porque só o @editorahumanas pode ser censurado e eu não?Eu odeio as feministas tanto qnt ele.. Elas só sabem dar e abortar!
#DireitosIguais",1,pt,Why only @editorahumanas can be censored and I don't? I hate feminists so much when he doesn’t. #Equal rights  
3050,3050,2357,Kkkkkkkkkkkkkkkkkkkkkkkk que mulher burra pqp,1,pt,0 replies 0 retweets 0 likes  
3051,3051,1348,Enquanto as mulheres falavam sobre a campanha 'Carnaval sem preconceito' e distribuíam material de divulgação em... https://t.co/bVTun7Gfrs,0,pt,While the women talked about the 'Carnival without prejudice' campaign and distributed promotional material at ... https://t.co/bVTun7Gfrs  
3052,3052,4001,RT @batman_reaca: Poliamor é desculpa de vagabunda pra fazer rodízio de piroca,1,pt,RT @batman_reaca: Poliamor is a slut's excuse to make a dick rotation  
3053,3053,55,"Acabámos de adicionar mais uma data à Tour 'Overdose de Tourette':
24 Fev - Ericeira.
Bilhetes na FNAC e aqui: _ https://t.co/2zTqP5irCM",0,pt,We just added another date to the Tour 'Overdose de Tourette': 24 Feb - Ericeira. Tickets at FNAC and here: _ https://t.co/2zTqP5irCM  
3054,3054,1231,"E ainda tem umas 4 ou 5 tatoo 
VAMO CASAR?",0,pt,And still have a 4 or 5 VAMO CASAR tattoo?  
3055,3055,1901,@gentebranca1 no perfil dele ainda contém machismo.,1,pt,@ gentebranca1 in his profile still contains machismo.  
3056,3056,4850,RT @ShedyaLouise: Os bonecos nunca serviram para expor sexualidade as crianças. Não vejo o objetivo disso https://t.co/eJI6qwgjul,0,pt,RT @ShedyaLouise: Dolls have never been used to expose children to sexuality. I don't see the purpose of this https://t.co/eJI6qwgjul  
3057,3057,4045,RT @BolsonaroSP: Bancada 'femina' aproveita dia internacional da mulher p/ aprovar lei que proíbe gestante dar a luz algemada. Já as mulher _,0,pt,RT @BolsonaroSP: 'Female' bench takes advantage of international women's day to approve law that prohibits pregnant women from giving birth in handcuffs. The women _  
3058,3058,1948,gorda e feia nao cabe na tela do celular de tão gorda https://t.co/FBL2xg6MwL,1,pt,fat and ugly does not fit on the phone screen so fat https://t.co/FBL2xg6MwL  
3059,3059,4267,RT @FolhadSP: Em homenagem a Revolução Russa; Bancada do Psol quer que relógios sejam atrasados em 1 Século https://t.co/Qdw0doK8WH,0,pt,RT @FolhadSP: In honor of the Russian Revolution; Psol bench wants clocks to be delayed by 1 century https://t.co/Qdw0doK8WH  
3060,3060,4084,RT @CapitalismoOP: Se ninguém ate hoje te chamou de fascista você ta fazendo algo de errado,0,pt,"RT @CapitalismoOP: If nobody has called you a fascist until today, you're doing something wrong  "
3061,3061,819,"@catarina_mart 
Então hoje debateram o 'PNR'?
Será que finalmente acabou o boicote e a censura ao meu partido?
@govpt @antoniocostapm",1,pt,@catarina_mart So today you discussed the 'PNR'? Has the boycott and censorship of my party finally ended? @govpt @antoniocostapm  
3062,3062,1343,E nesse dia da mulher confirmei o que eu já acreditava : TODA GENERALIZAÇÃO É BURRA !,1,pt,"And on that women's day, I confirmed what I already believed: ALL GENERALIZATION IS DONKEY!  "
3063,3063,2398,@LeoLimaDuarte @gabrisinhas pode crer que num deslize qualquer a gente arranja.,0,pt,@LeoLimaDuarte @gabrisinhas you can believe that in any slip we can fix it.  
3064,3064,4205,"RT @edmilsonpapo10: Ganhar elogio da @RachelSherazade 
Já ganhei a noite!  https://t.co/88OKwZEtdR",0,pt,RT @ edmilsonpapo10: Win praise from @RachelSherazade I already won the night! https://t.co/88OKwZEtdR  
3065,3065,3964,"RT @ALuizCosta: Prefeita de Calais, da direita 'moderada' (partido de Fillon), proíbe dar comida a refugiados https://t.co/LlB8SA3v4n",0,pt,"RT @ALuizCosta: Mayor of Calais, from the 'moderate' right (Fillon's party), prohibits giving food to refugees https://t.co/LlB8SA3v4n  "
3066,3066,5226,@STF_oficial como sempre o privilégio branco é visto,0,pt,@STF_oficial as always the white privilege is seen  
3067,3067,4165,"RT @direitafalando: morre de fome pq quer
carteira de trabalho é de graça",0,pt,RT @direitafalando: dies of hunger because you want a work card for free  
3068,3068,2239,Ja pensou se o Bial falasse 'Vem da o cu aqui fora Nasser' #FinalBBB13,1,pt,"Have you ever thought if Bial said 'Come on, ass out Nasser' # FinalBBB13  "
3069,3069,5401,"Trump discursa para o povo. Diz que 20 de janeiro será lembrado como o dia que o povo tomou o poder.
CHORA ESQUERDALHA GLOBAL",0,pt,Trump speaks to the people. He says that January 20 will be remembered as the day that the people took power. GLOBAL LEFT CRIES  
3070,3070,5339,@thiviecos @PastorMalafaia Seu professor MARXISTA (sua capa fora Temer diz tudo) te doutrinou melhor que o prof. da escola dominical,0,pt,@thiviecos @PastorMalafaia Your teacher MARXIST (your cover outside Temer says it all) indoctrinated you better than prof. Sunday school  
3071,3071,2697,minha sala só tem sapatao,1,pt,my room only has shoes  
3072,3072,4286,RT @GABRIELPlNHEIRO: @Estadao Esse padre já foi acusado de pedofilia e pagou a família da vítima,0,pt,RT @GABRIELPlNHEIRO: @Estadao This priest has already been accused of pedophilia and paid the victim's family  
3073,3073,117,"Adeus #Obama! 
'Faça boa viagem!'. https://t.co/B0CASUcZtH",0,pt,Goodbye #Obama! 'Have a good trip!' https://t.co/B0CASUcZtH  
3074,3074,5167,@snnjess Vira sapatão nunca te pedi nada.,1,pt,@snnjess It turns out I never asked you for anything.  
3075,3075,188,A @gleisi fazer greve...não trabalhar..É um alívio para o BRASIL... já que ela só faz atrapalhar o país mesmo. Devo _ https://t.co/EzKOlbn8YF,1,pt,To @gleisi go on strike ... not work ... It is a relief for BRAZIL ... since it only disturbs the country. I must _ https://t.co/EzKOlbn8YF  
3076,3076,4347,"RT @homemdbranco: Bye, bye... vão lá para o 2.º lugar #CarregaBenfica https://t.co/AHcMOc8zkH",0,pt,"RT @homemdbranco: Bye, bye ... go to 2nd place #ChargeaBenfica https://t.co/AHcMOc8zkH  "
3077,3077,5201,@SouBenfica1904 @SLBenfica que lindo é vermelho e branco!,0,pt,@ SouBenfica1904 @SLBenfica how beautiful it is red and white!  
3078,3078,3898,"RT @_tristezinha: Oi, @Mawara. Aguardo sua opinião sobre o quanto o islã massacra as mulheres. @elmalditocabron @otmar03",0,pt,"RT @_tristezinha: Hi, @Mawara. I await your opinion on how much Islam massacred women. @elmalditocabron @ otmar03  "
3079,3079,5370,"@TonhoDrinks @reasalvagni minha amiga, respeita",0,pt,"@TonhoDrinks @reasalvagni my friend, respect  "
3080,3080,1994,@gugachacra as diferenças no mundo islâmico não tornam a Europa o melhor lugar para os refugiados viverem. https://t.co/tAnD7PwgAq,0,pt,@gugachacra the differences in the Islamic world do not make Europe the best place for refugees to live. https://t.co/tAnD7PwgAq  
3081,3081,4734,"RT @PMERJ: Após denúncia, PMs do #25BPM prenderam um homem com uma pistola e 80 cápsulas de cocaína em uma localidade de #Unamar. #ServireP _",0,pt,"RT @PMERJ: After a complaint, PMs from # 25BPM arrested a man with a pistol and 80 cocaine capsules in a #Unamar location. #ServireP _  "
3082,3082,4282,RT @GABRIELPlNHEIRO: Bolsonaro diz no vídeo que é bom coibir jogos violentos pra crianças pequenas Cada um cuida do seu filho https://t.co/ _,0,pt,RT @GABRIELPlNHEIRO: Bolsonaro says in the video that it is good to prevent violent games for young children Each one takes care of his son https://t.co/ _  
3083,3083,3197,O orgulho hetero é tão válido quanto o orgulho homo. Se um pode ter orgulho por que o outro não? #orgulhohetero,0,pt,"Straight pride is just as valid as homo pride. If one can be proud, why can't the other? #hetero  "
3084,3084,37,"A ameaça do terrorismo radical islâmico é bem real, veja o que acontece na Europa e no Oriente Médio. Os tribunais _ https://t.co/cyd14kyXY0",0,pt,"The threat of radical Islamic terrorism is very real, see what happens in Europe and the Middle East. Courts _ https://t.co/cyd14kyXY0  "
3085,3085,2952,"Nessa quinta eu vou visitar pela primeira vez a @_boladeneve do Tatuapé
Ansioso",0,pt,This Thursday I will visit for the first time the @_boladeneve do Tatuapé Anxious  
3086,3086,5504,Vai começar mais uma sessão de torcida contra o Trump no @jornalnacional ...,0,pt,Another cheering session against Trump will start at @jornalnacional ...  
3087,3087,4914,RT @TourMicao: as sapatao vao domina o mundo https://t.co/gWVPCBohC6,1,pt,RT @TourMicao: shoes will take over the world https://t.co/gWVPCBohC6  
3088,3088,5443,"Uma #MulherDeVerdade acredita no amor, mas não vira refém dele.",0,pt,"A #MulherDeVerdade believes in love, but does not become a hostage to it.  "
3089,3089,5088,"Se os países muçulmanos não acolhem os refugiados muçulmanos (mesma língua e religião), por que o ocidente que é... https://t.co/1LQa2Nmaqr",0,pt,"If Muslim countries do not welcome Muslim refugees (same language and religion), why is the West ... https://t.co/1LQa2Nmaqr  "
3090,3090,33,"A afronta aos portugueses não pára!
https://t.co/mGEV4CjFRP#RenovarPortugal #PNR #Portugal #Imigração https://t.co/26j98jdIYH",0,pt,
3091,3091,1902,@gentebranca1 os negro não tá nem aí pode usar o que quiser http://t.co/gX57yWDWvN,1,pt,@ gentebranca1 the blacks don't even care what they want http://t.co/gX57yWDWvN  
3092,3092,5191,"Só pra deixar claro, @homemdeverdade não faz clube do macho, turminha da foda, essas merdas machistas de baitolas recatadas !",1,pt,"Just to make it clear, @homemdeverdade does not do macho club, fuck gang, these demure macho baitolas shit!  "
3093,3093,3445,Pelo menos ia proteger o ocidente do islam.,0,pt,At least it was going to protect the West from Islam.  
3094,3094,1253,é desmascarado e vem com ironia  hahahaha https://t.co/oBqaRTKmYl,0,pt,is unmasked and comes with irony hahahaha https://t.co/oBqaRTKmYl  
