,Unnamed: 0,Unnamed: 0.1,text,label,lang,translated
930,930,1080,"Depois de vender produtos ilegais o dia todo no centro do Rio, camelôzada se reúne pra queimar um no meio da rua: _ https://t.co/gtu7cntgBA",1,pt,"After selling illegal products all day in downtown Rio, camelôzada gathers to burn one in the middle of the street: _ https://t.co/gtu7cntgBA  "
931,931,5433,"uma chuva de tweets me xingando tiveram origem do site diario do nordeste, da globo. http://t.co/vEkpqYjj",1,pt,"a rain of tweets cursing me originated from the daily website of the northeast, from the globe. http://t.co/vEkpqYjj  "
932,932,1567,"'Eu acho q já se nasce c o bichinho de matrafona'(ouvido na SIC).
As desculpas q os homens dão à família pra justificar vestirem-se d mulher",1,pt,'I think we are already born with the matrafona bug' (heard on SIC). The excuses q men give to the family to justify dressing up a woman  
933,933,5037,Se Angola não for considerado melhor destino europeu em 2018 eu desisto da vida,1,pt,If Angola is not considered the best European destination in 2018 I will give up on life  
934,934,3621,PROCURO: uma criança que aguente trabalhar 12h/dia dentes fortes e q nao coma muito,0,pt,I am looking for a child who can work 12 hours / day strong teeth and do not eat too much  
935,935,1634,eu tenho problemas psicológicos causados pelo excesso de corrupção petista......,1,pt,I have psychological problems caused by the excessive PT corruption ......  
936,936,2864,não lava aquela cueca q acabou de comprar antes de usar,0,pt,don't wash that underwear you just bought before using it  
937,937,125,Adivinha qual a esquerda demoniza e qual a esquerda apoia? https://t.co/lmknzzuwLo,0,pt,Guess which left demonizes and which left supports? https://t.co/lmknzzuwLo  
938,938,3749,"QUE NOITE TERRÍVEL, SONHEI QUE TINHA VOTADO NA CHAPA DILMA / TEMER E AJUDADO A ELEGER ESSA QUADRILHA...
ACORDEI ALIVIADO FOI SÓ UM PESADELO",0,pt,"WHAT A TERRIBLE NIGHT, I DREAMED THAT I VOTED ON THE DILMA / FEAR PLATE AND HELPED TO ELECT THIS QUADRILHA ... I WOKE RELIEVED IT WAS JUST A NIGHTMARE  "
939,939,2552,"@MarleneBicalho Ia dar boa noite, mas, vc ja foi então, boa sexta! hahaha",0,pt,"@MarleneBicalho I was going to say good night, but, u already went then, good Friday! haha ha  "
940,940,3693,Quão baixo Obama foi pra grampear meus telefones durante um processo eleitoral sagrado. Isto é Nixon/Watergate. Car _ https://t.co/zXE4IlTA1B,0,pt,How low Obama went to tap my phones during a sacred electoral process. This is Nixon / Watergate. Car _ https://t.co/zXE4IlTA1B  
941,941,1057,"'De erro em erro, vai-se descobrindo toda a verdade.'
#MulherDeVerdade",0,pt,"'From error to error, the whole truth is discovered.' #Real woman  "
942,942,5521,Vamo invadir essa Hilux ae https://t.co/ef9ibPFrI1,0,pt,
943,943,3782,@RaabeBastos @OdeCarvalho @jairbolsonaro parabéns pela coragem! Abraços.,0,pt,@RaabeBastos @OdeCarvalho @jairbolsonaro congratulations on your courage! Hugs.  
944,944,2797,"nada melhor do que apreciar o impeachment aqui no meu ap na zona sul
só nao sei pq minha empregada tá chorando coitada nem conhece política",1,pt,nothing better than enjoying the impeachment here in my ap in the south zone I just don't know why my maid is crying  
945,945,1362,Entrevista com a @editorahumanas sobre a censura da OAB-SP! https://t.co/9xdr4TCI0R,0,pt,Interview with @editorahumanas about OAB-SP censorship! https://t.co/9xdr4TCI0R  
946,946,25,"[EXTRA] Imagine se fosse um branco fazendo isso com um muçulmano, seria notícia no país inteiro https://t.co/1PUC6Uj0gc",1,pt,"[EXTRA] Imagine if it were a white man doing this with a Muslim, it would be news all over the country https://t.co/1PUC6Uj0gc  "
947,947,3486,Pior coisa que eu fiz foi ter comprado esse tênis branco,0,pt,Worst thing I did was to buy that white sneaker  
948,948,4507,RT @LaudimaPalhares: @Curate_Angola @tivandro mas não é pra crianças,0,pt,
949,949,2565,@martabiancaa não acredito! Prova.,0,pt,@martabiancaa I can't believe it! Proof.  
950,950,375,AMore @JuhSavignon Ajuda a divulgar: O primeiro livro da @melaineribeiro 'A ESCRITORA E O MUSICO' www.aescritoraeomusico.blogspot.com,0,pt,AMore @JuhSavignon Help spread the word: The first book by @melaineribeiro 'A ESCRITORA EA MUSICO' www.aescritoraeomusico.blogspot.com  
951,951,2959,"NEYMAR FEZ O FAMOSO GOL 'OLHO AZUL EM GORDA'
BONITO, MAS NÃO SERVE PRA NADA",1,pt,"NEYMAR HAS THE FAMOUS GOAL 'OLHO AZUL EM GORDA' BEAUTIFUL, BUT IT'S NOT FOR ANYTHING  "
952,952,1194,"@dntwit 
Saloios = tacanhos, ignaros, parolos
Que ofensa racista contra o povo a norte de Lisboa! Mas quem pode, pode... faltar ao respeito.",1,pt,"@dntwit Saloios = narrow-minded, ignaros, parolos What a racist offense against the people north of Lisbon! But who can, can ... disrespect.  "
953,953,538,"As supostas revoltas nas cidades natais de alguns republicanos são na verdade, em muitos casos, premeditadas por at _ https://t.co/Pc6isOllYp",0,pt,"The alleged uprisings in the hometowns of some Republicans are actually, in many cases, premeditated by at _ https://t.co/Pc6isOllYp  "
954,954,2572,mas é claro q esquento... *____* http://t.co/yb1NuzEkOQ,0,pt,but of course q warm ... * ____ * http://t.co/yb1NuzEkOQ  
955,955,1,@_carmeloneto Estes incompetentes não cuidam nem do povo brasileiro e nem dos poucos refugiados que aqui estão.,0,pt,@_carmeloneto These incompetents do not care for the Brazilian people or the few refugees who are here.  
956,956,796,"cara, pode me chamar do que quiser! Quero ver refutar o que falei com fatos, lógica e verdades! https://t.co/7MAYryjrWU",0,pt,"man, you can call me whatever you want! I want to see refute what I said with facts, logic and truths! https://t.co/7MAYryjrWU  "
957,957,4250,RT @Fernando_Songo: @HumorNegroo Denunciei ! #TrolandocomHumorNegro haha,0,pt,RT @Fernando_Songo: @HumorNegroo #TrolandocomHumorNegro haha  
958,958,3343,Parabéns a Stephen Miller por me representar esta manhã nos vários programas matutinos de domingo. Ótimo trabalho! https://t.co/oub2u74RHa,0,pt,Congratulations to Stephen Miller for representing me this morning on the various Sunday morning programs. Great job! https://t.co/oub2u74RHa  
959,959,5507,Vai daí pelego! https://t.co/YSQkoolQSQ,0,pt,"Go on, hide! https://t.co/YSQkoolQSQ  "
960,960,5397,#TrolandocomHumorNegro está de volta com uma edição que ninguem pode perder. Quem quer trolar o pastor + ladrão do Brasil? @PastorMalafaia?,0,pt,#TrolandocomHumorNegro is back with an edition that no one can miss. Who wants to troll the shepherd + thief from Brazil? @PastorMalafaia?  
961,961,4792,"RT @ronaldocaiado: Como vamos estipular idade mínima de 65 anos para aposentadoria, se o cidadão arca com toda política de incentivos, bols _",0,pt,"RT @ronaldocaiado: How are we going to stipulate a minimum age of 65 for retirement, if the citizen bears all the incentives policy, pocket _  "
962,962,2314,@juancosta473 @editorahumanas @ClaudeLuca_ kkkkk... pelo menos é XX,0,pt,@ juancosta473 @editorahumanas @ClaudeLuca_ kkkkk ... at least it's XX  
963,963,382,A mulher é física nuclear cara... oq ela tá fazendo na cozinha? #masterchefBR,1,pt,The woman is expensive nuclear physics ... what is she doing in the kitchen? #masterchefBR  
964,964,2421,"Lindo cabide, todo em branco com coração de apliques em pérolas da noivinha Elisangela. https://t.co/X71LBb7bYO",0,pt,"Beautiful hanger, all in white with heart appliqué in pearls of the bride Elisangela. https://t.co/X71LBb7bYO  "
965,965,3852,@ricardo4769 @RuiHCruz Apenas demos início a um movimento,0,pt,@ ricardo4769 @RuiHCruz We just started a movement  
966,966,5177,SÓ FUNCIONA COM CHIP CLARO https://t.co/tkEWfjsVIF,0,pt,ONLY WORKS WITH LIGHT CHIP https://t.co/tkEWfjsVIF  
967,967,2087,"@homemdeverdade pega forte na cintura da sua fêmea, essa coisa de delicadeza nessas horas é desses Jonnys Manés Citricos bunda mole!",1,pt,"@homemdeverdade takes a strong hold on his female's waist, this thing of delicacy at these times is one of those Jonnys Manés Citricos soft ass!  "
968,968,3941,"RT @alex_borges: Feminismo 2017:
1. Homens ocidentais, usem saia e batom!
2. Abram as fronteiras para os muçulmanos!
Ligue os pontos",1,pt,"RT @alex_borges: Feminism 2017: 1. Western men, wear a skirt and lipstick! 2. Open the borders for Muslims! Connect the dots  "
969,969,2,"@_carmeloneto 
Os 'cumpanhero' quebraram todas as regras.",0,pt,@_carmeloneto The 'cumpanhero' broke all the rules.  
970,970,5099,sera que o povo do meu serviço vai notar se eu levar um colchão amanha,0,pt,will be that the people of my service will notice if I bring a mattress tomorrow  
971,971,3322,"@pablovillaca pooo, esse aí é otimista hein",0,pt,"@pablovillaca pooo, this one is optimistic huh  "
972,972,5229,Sua mãe admirando as estátuas qdo faz turismo https://t.co/rzl5N7qDwh,0,pt,Your mother admiring the statues when you tour https://t.co/rzl5N7qDwh  
973,973,4983,@RuiHCruz Tenta a Olga Cardoso,0,pt,@RuiHCruz Try Olga Cardoso  
974,974,3772,"Quero ver essa versão do Mad Max em preto e branco, parece bem maneira",0,pt,"I want to see this version of Mad Max in black and white, it looks pretty cool  "
975,975,2936,"Ñ conheço Putin, ñ tenho negócios na Rússia e os haters estão insanos - mas Obama pode negociar com o Iran, #1 em t _ https://t.co/m41QXLBhNz",0,pt,"Ñ I know Putin, ñ I have business in Russia and the haters are insane - but Obama can negotiate with Iran, # 1 in t _ https://t.co/m41QXLBhNz  "
976,976,1269,Eduardo Lourenço: “O islão sente a nossa fraqueza” https://t.co/fSDG7p2wjh,0,pt,Eduardo Lourenço: “Islam feels our weakness” https://t.co/fSDG7p2wjh 
977,977,443,@AntonioGeovani4 Angola não wi,0,pt,@ AntonioGeovani4 Angola no wi  
978,978,3886,RT @_cinnamongirl: eu toda vez que vejo alguém falando que racismo inverso existe http://t.co/LIEJJCUlVy,0,pt,RT @_cinnamongirl: every time I see someone saying that reverse racism exists http://t.co/LIEJJCUlVy  
979,979,4337,RT @g1: União Europeia ameaça com sanções países que não recebem refugiados https://t.co/1NhmlIjodx #G1 https://t.co/ec53B4iKZ7,0,pt,RT @ g1: European Union threatens sanctions for countries that do not receive refugees https://t.co/1NhmlIjodx # G1 https://t.co/ec53B4iKZ7  
980,980,5487,"uns tem saco, nós temos culhões !!!!!!!!!!!!!!!!!!!",1,pt,"some have bags, we have balls !!!!!!!!!!!!!!!!!!!  "
981,981,2288,"@JornalNoticias @FelisbelaLopes 
E quais os limites da prepotência do #CarteldaComunicaçãoSocial, da censura arbitrária e da discriminação?",0,pt,"@JornalNoticias @FelisbelaLopes And what are the limits of the arrogance of # CarteldaComunicaçõesSocial, arbitrary censorship and discrimination?  "
982,982,528,"As refeições na #AssembleiaRepública deveriam ser iguais às das cantinas das escolas. Isso sim, seria dar o exemplo!
@govpt @antoniocostapm",0,pt,Meals at # AssembleiaRepública should be the same as in school canteens. That would be an example! @govpt @antoniocostapm  
983,983,145,"A esquerda fala muito sobre essas rebeliões e justificam a 'superlotação', mas não fala do motivo que fizeram eles irem pras prisões.",0,pt,"The left talks a lot about these rebellions and justifies 'overcrowding', but it doesn't talk about why they went to prisons.  "
984,984,2721,moro prendeu o cunha? ué mas e o lula? e a dilma? e o PT? https://t.co/8Vql60TzM8,0,pt,Moro arrested the wedge? but what about the squid? and dilma? and the PT? https://t.co/8Vql60TzM8  
985,985,545,ÁS VEZES O SALÁRIO POUCO IMPORTA QUANDO A GENTE TRABALHA SENTINDO PRAZER https://t.co/JguY8eeq7n,0,pt,SOMETIMES SALARY LITTLE MATTERS WHEN PEOPLE WORK FEELING PLEASURE https://t.co/JguY8eeq7n  
986,986,2403,"@leticiabahia23 A mulher não precisa ser obrigatoriamente feminista para ser mulher , porque a maioria não compact _ https://t.co/7LJcsVaBWN",0,pt,"@ leticiabahia23 Women don't necessarily have to be feminists to be women, because most are not compact _ https://t.co/7LJcsVaBWN  "
987,987,1378,E os amarelos? E os gordos? E os trans?? Isso é discriminação!! Vamos colocar todos lá dentro!! https://t.co/FHaRPeS0oG,0,pt,And the yellow ones? And the fat ones? And the trans ?? This is discrimination !! Let's put everyone in there !! https://t.co/FHaRPeS0oG  
988,988,2045,"@HevertonJhon @benebarbosa_mvb ahaha  dsculpa, ja corrigi",0,pt,"@HevertonJhon @benebarbosa_mvb ahaha dsculpa, already corrected  "
989,989,1974,Grande honra comparecer ontem ao recebimento dos restos mortais de Ryan Owens com minha filha Ivanka. Um grande e corajoso homem-obrigado!,0,pt,It was a great honor to attend yesterday the reception of Ryan Owens' remains with my daughter Ivanka. A great and courageous man-thank you!  
990,990,2684,#MinhaDorImporta 'esses furos na orelha é coisa de 'sapatão'',1,pt,#MinhaDorImporta 'these holes in the ear is a' dyke 'thing' '  
991,991,2065,'Hoje é segunda-feira.' Um dia como outro qualquer. 'Mas olha que é dia 13.' Não sou supersticioso. 'A gasolina voltou a aumentar'. Foda-se!,0,pt,'Today is Monday.' A day like any other. 'But look at the 13th.' I'm not superstitious. 'Gasoline increased again'. Fuck it!  
992,992,5476,"Um novo dia é uma página em branco na sua vida. 
Escreva apenas o que vale a pena. 
Bom dia! https://t.co/7929FzzDuc",0,pt,A new day is a blank page in your life. Write only what is worth. Good Morning! https://t.co/7929FzzDuc  
993,993,2080,"Homem de verdade não bate em mulher! Isso é coisa de imbecil, de babaca, de covardes bundões.",0,pt,"Real men don't hit women! This is an asshole thing, an asshole, coward asses.  "
994,994,1845,@FussballSehr  O problema que não temos estrutura pra acolher todos os refugiados e ilegais que aqui aportam estamos próximos a mendigar,0,pt,@FussballSehr The problem that we have no structure to accommodate all the refugees and illegal immigrants that we land here are close to begging  
995,995,3579,Pra que horas ficou marcado o panelaço? https://t.co/YqyvR0JWLS,0,pt,What time was the pot scheduled? https://t.co/YqyvR0JWLS  
996,996,4866,RT @SouBenfica1904: Dortmund está pintada de vermelho e branco! #SejaOndeFor #UCL #BVBxSLB https://t.co/DjbtGk2uHh,0,pt,RT @ SouBenfica1904: Dortmund is painted red and white! #SejaOndeFor #UCL #BVBxSLB https://t.co/DjbtGk2uHh  
997,997,2406,@leticiabahia23 vc ta no meio termo entre o idiota útil e a massa de manobra da esquerda @InesBolsonaro @otmar03 @ajulysantos,0,pt,@ leticiabahia23 you are in the middle between the useful idiot and the left maneuver mass @InesBolsonaro @ otmar03 @ajulysantos  
998,998,77,"Acho mal que não tenham metido a carreira da Bárbara Guimarães neste 'In memoriam'
#Oscars",0,pt,I think it's bad that Bárbara Guimarães' career was not included in this' In memoriam '#Oscars  
999,999,3256,"Os guris de nutrição da minha faculdade são todos iguais 
Branco musculosinho tatuagem maori no braço",0,pt,The nutrition guys at my college are all the same Muscular white Maori tattoo on the arm  
1000,1000,3263,"Os mais jovens do @pnr 
#RenovarPortugal #Portugal #PNR https://t.co/co7Ywrldht",0,pt,The youngest of @pnr #RenovarPortugal #Portugal #PNR https://t.co/co7Ywrldht  
1001,1001,863,"Chilenos que fugiram de Caxias foram capturados em Madrid. Mesmo assim, estiveram mais tempo em liberdade do que o Porto em primeiro lugar.",1,pt,
1002,1002,164,Aff só por que não tem negro no oscar agora eles sao racista........ pfvr miga melhore,0,pt,Aff just because there is no black in oscar now they are racist ........ pfvr miga better  
1003,1003,4736,"RT @pnr: PNR presta homenagem ao último grande Estadista que Portugal viu nascer.
 #notascampanha #RenovarPortugal http://t.co/5KYUr2jbIE",0,pt,RT @pnr: PNR pays tribute to the last great statesman that Portugal was born. #notascampanha #RenovarPortugal http://t.co/5KYUr2jbIE  
1004,1004,4465,RT @jpintocoelho60: Destinado aos teimosos (tantos!!) que acham utilidade no chamado 'voto útil'. Percebam que é simplesmente voto traidor. _,0,pt,RT @ jpintocoelho60: Intended for the stubborn (so many !!) who find use in the so-called 'helpful vote'. Realize that it is simply a traitorous vote. _  
1005,1005,683,@BolsonaroSP E bota bizarro nisso!,0,pt,@BolsonaroSP And put bizarre on it!  
1006,1006,3949,RT @alexandregarcia: Não entendo como a pessoa confessa o crime e ainda é chamada de suspeito.,0,pt,RT @alexandregarcia: I don't understand how the person confesses to the crime and is still called a suspect.  
1007,1007,241,"ainda tem tráfico pq tem gente que compra
se a compra voltasse a ser crime tudo estaria em harmonia",0,pt,there is still traffic because there are people who buy if buying becomes a crime everything would be in harmony  
1008,1008,4891,RT @Theocoxinha: Eu sou protetor de animais e  sou totalmente contra zoofilia! Sexo com animais é nojento e criminoso! não compartilhem ess _,1,pt,RT @Theocoxinha: I am a protector of animals and I am totally against zoophilia! Sex with animals is disgusting and criminal! do not share this _  
1009,1009,3664,"Quando acabarem de ler o novo livro do Cavaco, recomendo também este! https://t.co/zr9lpFlyyS",0,pt,"When you've finished reading Cavaco's new book, I also recommend this one! https://t.co/zr9lpFlyyS  "
1010,1010,4780,RT @renatamotta: Quando o ônibus lotado faz a curva  https://t.co/oKK3tvABLX,0,pt,RT @renatamotta: When the crowded bus makes the turn https://t.co/oKK3tvABLX  
1011,1011,2021,@hannaroehe eu que agradeço,0,pt,@hannaroehe I thank you  
1012,1012,1092,"'Desculpem por eu não ter acreditado, mas hoje vocês me fizeram ser o homem mais feliz de Angola, mesmo com a crise _ https://t.co/ZmfBKn87GZ",0,pt,"'Sorry for not believing, but today you made me the happiest man in Angola, even with the crisis _ https://t.co/ZmfBKn87GZ  "
1013,1013,5508,Vai dai seus chato https://t.co/wBZfb04LSw,1,pt,0 replies 0 retweets 0 likes  
1014,1014,3374,"Para ler. 'O Islão tem um problema com a mulher.'
https://t.co/4FRtxqXUsq",0,pt,To read. 'Islam has a problem with women.' https://t.co/4FRtxqXUsq  
1015,1015,1183,"Dizem que o muro do Trump não será eficaz, mas olhem que os chineses construíram um há mais de 2000 anos e ainda não têm lá mexicanos...",1,pt,"They say that the Trump wall will not be effective, but look that the Chinese built one more than 2000 years ago and still don't have Mexicans there ...  "
1016,1016,1275,"É elogiável algumas ações do @atletico : moradores de ruas no estádio, ações com refugiados e crianças..Pq não por esse tema em pauta?",0,pt,"Some of @atletico's actions are commendable: street dwellers in the stadium, actions with refugees and children. Why not for that topic?  "
1017,1017,3012,N vou aguentar aquele tanto de sapatão na sala que fica me encarando..,1,pt,I will not be able to handle that much of a dork in the room that keeps staring at me ..  
1018,1018,2634,"Mesmo a pedidos, me recuso falar do BBB! @homemdeverdade não entra em programinha pra ganhar milhão. A gente ganha na batalha do dia a dia!",0,pt,"Even on requests, I refuse to talk about the BBB! @homemdeverdade does not enter a program to earn a million. We win in the day-to-day battle!  "
1019,1019,3470,"PESSOAL ME CHAMANDO DE 'TRANSFÓBICO' RISOS
TRABALHEI 22 ANOS EM UMA TRANSPORTADORA, COMO VOU TER FOBIA DE TRANSPORTES? INVENTEM OUTRA. #PAZ",0,pt,"PERSONNEL CALLING ME 'TRANSFÓBICO' RISOS I WORKED 22 YEARS IN A CARRIER, HOW WILL I HAVE FOBIA OF TRANSPORT? INVENT ANOTHER. #PEACE  "
1020,1020,4368,"RT @InesBolsonaro: - Alô Trump ta afim de irritar a esquerda?
- To mas como?
- É só nós tirar uma foto juntos 
- Blz cola aqui na casa bran _",1,pt,"RT @InesBolsonaro: - Hello Trump, do you want to irritate the left? - But how? - Just take a picture together - Blz glue here at the white house _  "
1021,1021,3076,"O dia que todos os muçulmanos morrer,certeza que o inferno vai sobrecarregar.",1,pt,"The day that all Muslims die, sure that hell will overwhelm them.  "
1022,1022,3895,RT @_LAERTO: Até o quebrando o Tabu já ta pedindo desculpas mas tem nego confirmando a história que foi Homicídio https://t.co/wQjTKJWm6S,0,pt,RT @_LAERTO: Even breaking the taboo is already apologizing but there is no denying confirming the story that it was Homicide https://t.co/wQjTKJWm6S  
1023,1023,60,acabei de pagar 20 reais em um carregador pq esqueci o meu. já começando o dia se sentindo a mulher mais burra do brasil,1,pt,i just paid 20 reais in a charger cuz i forgot mine. starting the day feeling like the dumbest woman in Brazil  
1024,1024,2044,Heterosexual e homem de verdade #twittealgomuitoantigo,0,pt,Heterosexual and real man #twittealgomuitooldigo  
1025,1025,5004,SAIR DO ARMÁRIO #JoaquinResponde https://t.co/1N8yS4b1Ba,0,pt,GET OUT OF THE CABINET #JoaquinResponde https://t.co/1N8yS4b1Ba  
1026,1026,1222,1 dúvida: quem tem preguiça vai pro inferno ou eles buscam em casa?,0,pt,1 doubt: whoever is lazy goes to hell or do they search at home?  
1027,1027,2662,"@miguelcarvalhu 
Pronto, discordamos nisso. 
Mas pelo menos vejo em si um interlocutor com nível e educação. :)",0,pt,"@miguelcarvalhu Okay, we disagree with that. But at least I see you as an interlocutor with level and education. :)  "
1028,1028,1435,Essa é a 'lógica' deste jovem 'sensato' --> @GLStecanela https://t.co/jXgmUuMkWD,0,pt,That's the 'logic' of this 'wise' young man -> @GLStecanela https://t.co/jXgmUuMkWD  
1029,1029,4593,RT @missnarcisista: Tô amando muito o perfil do @Justiceiro_Sujo. Expondo os justiceiros sociais politicamente corretos mas que na verdade _,0,pt,RT @missnarcisista: I'm really loving the @Justiceiro_Sujo profile. Exposing the politically correct social vigilantes but in fact _  
1030,1030,4078,RT @canalfutura: E assistir a qualquer momento aqui: https://t.co/YL6a1jp6sh https://t.co/K6ggeMUtNN,0,pt,RT @canalfutura: And watch anytime here: https://t.co/YL6a1jp6sh https://t.co/K6ggeMUtNN  
1031,1031,5429,Uma atitude reprovável de @aapbatista da bancada do @psocialista https://t.co/HG5RiUuDMH,1,pt,A reproachful attitude from @aapbatista from the @psocialista bench https://t.co/HG5RiUuDMH  
1032,1032,3288,"O SUS está sucateado, não consegue atender o cidadão com problemas graves de saúde, não tem medicamento, os... https://t.co/2rM5BJMsAA",0,pt,"SUS is scrapped, unable to serve the citizen with serious health problems, has no medicine, the ... https://t.co/2rM5BJMsAA  "
1033,1033,4407,RT @joanag129: Que lindo é vermelho e branco  #carregabenfica #TheWalkingDead https://t.co/rbBjoUxPlB,0,pt,RT @ joanag129: How beautiful is red and white # chargeabenfica #TheWalkingDead https://t.co/rbBjoUxPlB  
1034,1034,2516,' @maitabom Doces ou travessuras? ' Os dois! Não necessariamente nessa órdem rs... ;),0,pt,'@maitabom Trick or treat? ' Both! Not necessarily in this order lol ...;)  
1035,1035,4500,RT @K_prishe: @NAOKAHLO realizei o sonho dá minha esposa e levei ela pra NYC e é claro não podia faltar o yellow umbrella  https://t.co/ _,0,pt,RT @K_prishe: @NAOKAHLO I made my wife's dream come true and took her to NYC and of course I couldn't miss the yellow umbrella https://t.co/ _  
1036,1036,3401,"Pasta de leite Ninho 
Pão de lo branco recheios  ganache com Ninho e morangos .
#BolosEmUberlândia  #Paodequeijo https://t.co/bRKxo8KJgk",0,pt,Milk paste Ninho Pão de lo white fillings ganache with Ninho and strawberries. # CakesEmUberlândia #Paodequeijo https://t.co/bRKxo8KJgk  
1037,1037,4836,"RT @SargentoFAHUR: Daniela Mercury parou de tocar quando seu bloco passou pela Polícia Militar. Obrigado, ouvido de PM não é pinico.",1,pt,"RT @SargentoFAHUR: Daniela Mercury stopped playing when her block passed through the Military Police. Thanks, PM's ear isn't pinico.  "
1038,1038,583,Austria: refugiados iraquianos que praticaram estupro coletivos não serão deportados https://t.co/ZvCVo0qgSL,0,pt,Austria: Iraqi refugees who committed collective rape will not be deported https://t.co/ZvCVo0qgSL  
1039,1039,428,@annoyingbru virou fiscal de piada agora? manda a multa la pra casa,0,pt,@annoyingbru became a joke inspector now? send the ticket home  
1040,1040,4431,"RT @JOAQUINVOLTOU: PUTA QUE PARIU, ALGUÊM ENTENDEU ALGUMA COISA? https://t.co/5VIe6Lcexx",0,pt,"RT @JOAQUINVOLTOU: FUCK THAT HAPPENED, DID ANYONE UNDERSTAND ANYTHING? https://t.co/5VIe6Lcexx  "
1041,1041,4305,RT @GABRIELPlNHEIRO: Senhora de 86 anos reage a assalto e mata bandido https://t.co/j5EkVQ93pD,0,pt,RT @GABRIELPlNHEIRO: 86 year old lady reacts to robbery and kills bandit https://t.co/j5EkVQ93pD  
1042,1042,1385,É por isso que esse país está da forma que está ...e isso pq a USP é uma das melhores universidades . Tem gente que _ https://t.co/06EPcW7wqB,0,pt,That's why this country is the way it is ... and because USP is one of the best universities. There are people who _ https://t.co/06EPcW7wqB  
1043,1043,4839,"RT @savoltrath: @HumorNegroo Basicamente as pessoas dão risada dos outros, mas quando é com eles todo mundo fica bravo.",0,pt,"RT @savoltrath: @HumorNegroo Basically people laugh at others, but when it comes to them, everyone gets angry.  "
1044,1044,4823,"RT @rpsantos1970: Quão 'democratas' e 'tolerantes' são estes esquerdistas, estes 'direitinhas' e estes 'politicamente correctos'. 
https:// _",0,pt,"RT @ rpsantos1970: How 'democratic' and 'tolerant' are these leftists, these 'little rights' and these 'politically correct'. https: // _  "
1045,1045,5035,se a menina chama rayane quando faz 15 anos automaticamente fica grávida,1,pt,if the girl calls rayane when she turns 15 she automatically becomes pregnant  
1046,1046,3421,@pecesiqueira Não acredita em Jesus...e acredita no PT  https://t.co/AtRoD0XmMm,0,pt,@pecesiqueira Don't believe in Jesus ... and believe in PT https://t.co/AtRoD0XmMm  
1047,1047,5290,Temer vai levar no 1 turno  https://t.co/tUrZsOwBoV,0,pt,Temer will take in the 1st round https://t.co/tUrZsOwBoV  
