,Unnamed: 0,Unnamed: 0.1,text,label,lang,translated
1966,1966,2300,@JoselitoMuller3 eu pensei o mesmo....,0,pt,@ JoselitoMuller3 I thought the same ....  
1967,1967,3730,Quem estupra ou mata é vítima da sociedade. Quem dá share em post público de mídia social é criminoso. Tem algo muito errado aí.,0,pt,Who rapes or kills is a victim of society. Anyone who shares a public social media post is a criminal. There is something very wrong there.  
1968,1968,3416,@paulogarcia1970 Assim tem mais sabor,0,pt,@ paulogarcia1970 It has more flavor  
1969,1969,4636,"RT @nostrendsbrasil:  “Eu me envergonho', diz Rachel Sheherazade sobre Gleise Hoffmann”
https://t.co/O3U0r43Swp @gleisi https://t.co/KQwz _",0,pt,"RT @nostrendsbrasil: “I am ashamed ', says Rachel Sheherazade about Gleise Hoffmann” https://t.co/O3U0r43Swp @gleisi https://t.co/KQwz _  "
1970,1970,4406,"RT @joabee_: Isso é mt mais relevante do q dar desconto PARA mulheres. Ao invés disso, eles promovem o trabalho intelectual delas. Parabéns _",0,pt,"RT @joabee_: This is much more relevant than giving a discount TO women. Instead, they promote their intellectual work. Congratulations _  "
1971,1971,3006,N sou racista pq racismo É CRIME e crime é coisa de pretokkkkkk,1,pt,I am NOT a racist because racism IS CRIME and crime is a black thing  
1972,1972,4994,"Sacanagem é chegar no orfanato cantando: UUHH PAPAI CHEGOU, UUHH UUHH PAPAI CHEGOU",0,pt,"Slutty is arriving at the orphanage singing: UUHH PAPAI ARRIVED, UUHH UUHH PAPAI ARRIVED  "
1973,1973,4473,"RT @jpintocoelho60: Nomes não faltam: vigaristas, corruptos, aldrabões, assassinos, vendidos, traidores, pedófilos, aberrações...
#25Abril _",1,pt,"RT @ jpintocoelho60: There is no shortage of names: swindlers, corrupt, hooligans, murderers, sold, traitors, pedophiles, freaks ... # 25April _  "
1974,1974,4834,RT @samucasg: Orgulho Hetero seempree,0,pt,RT @samucasg: Straight Pride seempree  
1975,1975,4532,RT @lokocorreia: @HumorNegroo jornal esse que é feito com folha de bananeira,1,pt,RT @lokocorreia: @HumorNegroo newspaper that is made with banana leaf  
1976,1976,2843,Não é só isso! Falta punição pra estuprador e assassinos! https://t.co/p8VW4BK7Gi,0,pt,It's not just that! There is no punishment for rapists and murderers! https://t.co/p8VW4BK7Gi  
1977,1977,594,"Aviso: hoje na Suécia, amanhã em Portugal.
Só o #PNR pode evitar isto no nosso país!
#Sweden @realDonaldTrump https://t.co/7WNiOY1LFc",0,pt,"Warning: today in Sweden, tomorrow in Portugal. Only #PNR can prevent this in our country! #Sweden @realDonaldTrump https://t.co/7WNiOY1LFc  "
1978,1978,2263,"#JesusEstáVoltando
DUVIDO... NO MÁXIMO ELE MANDA O METEORO. https://t.co/oTPUtLfSsg",0,pt,# JesusEstáVoltando DOUBT ... AT THE MAXIMUM HE HAS THE METEORO. https://t.co/oTPUtLfSsg  
1979,1979,4426,RT @JOAQUINVOLTOU: ESSE P.S.G. É UM SÃO CAETANO QUE FALA FRANCÊS,0,pt,RT @JOAQUINVOLTOU: THAT P.S.G. IT'S A SAINT CAETAN SPEAKING FRENCH  
1980,1980,4985,"..Ryan morreu numa missão vitoriosa (segundo General Mattis), não uma 'falha.' Hora dos EUA ficar esperto e começar _ https://t.co/AhggQQqt8m",0,pt,"..Ryan died on a victorious mission (according to General Mattis), not a 'failure.' US time to get smart and start _ https://t.co/AhggQQqt8m  "
1981,1981,3695,"QUARTA FEIRA 8:49
PAGAR AS PROSTITUTA
LIMPA A CHURRASQUERA
TIRA DO CANAL PORNÔ
COLOCAR NA REDE VIDA
EXAME DE SANGUE
ORAÇÃO
#CarnavalAcabouE",0,pt,WEDNESDAY 8:49 PAY THE CLEAN PROSTITUTE THE BARBECUE STRIP OF THE PORN CHANNEL PUT ON THE LIFE NETWORK BLOOD EXAMINATION PRAYER #CarnavalAcabouE  
1982,1982,1681,"Faltam neste momento, pelo menos, 1200 Guardas Prisionais nas nossas cadeias. 
https://t.co/s8KYk8ecNt#GuardasPrisionais #Portugal",0,pt,At least 1200 Prison Guards are currently missing from our jails. https://t.co/s8KYk8ecNt#GuardasPrisonais #Portugal  
1983,1983,4101,RT @castellarinando: IGREJA Católica Está Em Plena Decadência Padre Júlio Lancellotti Acusado De Pedofilia Se Mete Em POLÍTICA e Ataca BOLS _,0,pt,RT @castellarinando: Catholic CHURCH is in full decay Father Júlio Lancellotti accused of pedophilia gets into politics and attacks BOLS _  
1984,1984,4937,RT @viktortora: Acção na Figueira da Foz https://t.co/nLwhy9CsY1,0,pt,RT @viktortora: Action in Figueira da Foz https://t.co/nLwhy9CsY1  
1985,1985,3611,"Primeira vez que saio todo de branco, as pessoas vão achar que sou pai de santo",0,pt,"First time I leave all white, people will think I'm a saint's father  "
1986,1986,2510,Mais uma da guerreira @dianafigueredoo ao vivasso & receba @mandy_sant https://t.co/R0ZW1ZSkc7,0,pt,More of the warrior @dianafigueredoo ao vivasso & receive @mandy_sant https://t.co/R0ZW1ZSkc7  
1987,1987,2099,Homem que é homem come doritos de pimenta com geléia extra-forte de pimenta e guaraná ice.,0,pt,Man who is a man eats pepper doritos with extra-strong pepper jelly and guarana ice.  
1988,1988,887,"@coebravo foda se ela to nem ai, gorda feia idiota",1,pt,"@coebravo fuck if she's not even there, ugly fat idiot  "
1989,1989,4136,"RT @Deia_Gut: @g1 Mas soltar o assassino Bruno tá de boas, né STF.",1,pt,"RT @Deia_Gut: @ g1 But letting go of the killer Bruno is fine, right, STF.  "
1990,1990,669,"Boicote mediático ao PNR: crime no jornalismo (Veja o Vídeo) 
https://t.co/4h1Mg8ibyv",0,pt,Media boycott of PNR: crime in journalism (See Video) https://t.co/4h1Mg8ibyv  
1991,1991,4567,"RT @mariia_pitanga:  azeiteiro, quero q te fodas volta para a tua terra",1,pt,"RT @mariia_pitanga: olive oil, I want you to fuck you back to your land  "
1992,1992,4723,RT @Paulox36: Noruega: refugiados não aceitam apartamentos populares não; exigem casas! https://t.co/5DFEpAP5NG,1,pt,RT @ Paulox36: Norway: refugees do not accept popular apartments; require houses! https://t.co/5DFEpAP5NG  
1993,1993,198,Agora pareço aqueles gajos que se viram para as fufas e dizem que ela são fufas pq nunca experimentaram pila (????????) Lol,1,pt,Now I look like those guys who turn to the fuffs and say they are fuffs because they never tried a dick (????????) Lol  
1994,1994,3393,"passando aqui pela zona oeste e pensando como esses pobres conseguem se enfiar no brt q nem sardinha
prefiro meu 4x4",0,pt,
1995,1995,3396,Passando na sua timeline uma imagem que não revolta as feministas... https://t.co/XrJ2G1AIfq,0,pt,Passing on your timeline an image that does not revolt feminists ... https://t.co/XrJ2G1AIfq  
1996,1996,4391,"RT @JanainaDoBrasil: 12- estou falando de empresários e grupos milionários, que se beneficiam de financiamentos que, a meu ver, deveriam se _",1,pt,"RT @JanainaDoBrasil: 12- I'm talking about entrepreneurs and millionaire groups, who benefit from financing that, in my opinion, should be _  "
1997,1997,458,"'Apenas uma brincadeira', dizem https://t.co/o3Qw3zAlIN",0,pt,"'Just a joke', say https://t.co/o3Qw3zAlIN  "
1998,1998,2512,"MAIS UM CASO DE CARECAFOBIA.
ATÉ QUANDO? https://t.co/MvBRhsd532",0,pt,ANOTHER CASE OF CARECAFOBIA. UNTIL WHEN? https://t.co/MvBRhsd532  
1999,1999,1371,22:00 e o @jairbolsonaro tá como agora? https://t.co/6iaCmFSfLZ,0,pt,22:00 and @jairbolsonaro is like now? https://t.co/6iaCmFSfLZ  
2000,2000,1909,"gente eu não sou latino só por ter nascido no brasil né, latinos são sujos, eu tomo banho",1,pt,"people i'm not latin just because i was born in brazil, latinos are dirty, i take a shower  "
2001,2001,3830,Relatório de Força de Trabalho do LinkedIn: Jan e Fev foram consecutivamente os meses mais fortes para contratação _ https://t.co/ddcouzuDKO,0,pt,LinkedIn Workforce Report: Jan and Feb were consecutively the strongest months for hiring _ https://t.co/ddcouzuDKO  
2002,2002,1421,espero que no fim da vida tenha uns brindes pra quem não se matou,0,pt,I hope that at the end of life there are some gifts for those who didn't kill themselves  
2003,2003,1833,Freezer Horizontal 439L EFH500S Branco Esmaltec https://t.co/6hFFo3HIya + Cupom de Desconto: RCA-27231 https://t.co/LgcPygFpoN,0,pt,Horizontal Freezer 439L EFH500S White Esmaltec https://t.co/6hFFo3HIya + Discount Coupon: RCA-27231 https://t.co/LgcPygFpoN  
2004,2004,3013,@nyahler Eu mesmo me considero mais bonito que o George Cloney ...,0,pt,@nyahler I consider myself more handsome than George Cloney ...  
2005,2005,539,As teta da loirinha tá demais #altashoras https://t.co/LlS954cBjO,1,pt,The tits of the blonde are too #highhigh https://t.co/LlS954cBjO  
2006,2006,718,Bora escrever mais um capítulo de nossa vida em uma folha em branco que deus nos deu.#bomdia,0,pt,Let's write another chapter of our life on a blank sheet that God gave us.  
2007,2007,1103,DEU CERTO O IMPITIMA? EU QUE ASSUMO HOJE????,0,pt,IS IMPITIMA RIGHT? WHAT DO I TAKE TODAY ????  
2008,2008,3466,@perryoutside @RachelSherazade @joicehasselmann OK...existem mulheres de direita e de esquerda. Se vc nao é bandida..foi pra vc tambem,0,pt,@perryoutside @RachelSherazade @joicehasselmann OK ... there are women on the right and on the left. If you are not a bandit ... it was for you too  
2009,2009,3539,"Porque normalmente as fufas e os paneleiros são com... —_ Pára de criar estereótipos, isso é horrível https://t.co/E59rr5vJOh",1,pt,"Because usually fufas and potters are with ... —_ Stop creating stereotypes, this is horrible https://t.co/E59rr5vJOh  "
2010,2010,64,A caminho da Base Militar Andrews com o Primeiro Ministro Shinzo hoje mais cedo. https://t.co/0YAUn4dMKJ,0,pt,On the way to Andrews Military Base with Prime Minister Shinzo earlier today. https://t.co/0YAUn4dMKJ  
2011,2011,4623,"RT @NAOKAHLO: Repita comigo:
Não espere que ele vá mudar por mim
Não espere que ele vá mudar por mim
Não espere que ele vá mudar por mim 
N _",0,pt,RT @NAOKAHLO: Repeat with me: Don't expect him to change for me Don't expect him to change for me Don't expect him to change for me N _  
2012,2012,3604,"Presidente @jpintocoelho60 em entrevista ao Jornal I
#RenovarPortugal #PNR #Portugal #JoséPintoCoelho https://t.co/QYAgloslVG",0,pt,President @ jpintocoelho60 in an interview with Jornal I #RenovarPortugal #PNR #Portugal # JoséPintoCoelho https://t.co/QYAgloslVG  
2013,2013,1594,"Eu, Nacionalista me confesso!
https://t.co/vWinrjkfkz#PNR #RenovarPortugal #Portugal",0,pt,"I, a Nationalist, confess! https://t.co/vWinrjkfkz#PNR #RenovarPortugal #Portugal  "
2014,2014,227,"“ai, luigi, mas vc ta militando? q saco”
.
pois é pq eu entendo os privilégios que eu tenho por ter nascido homem branco",1,pt,"“Oh, luigi, but are you fighting? q bag ”. because it is because I understand the privileges I have because I was born a white man  "
2015,2015,1815,"Foi lamentável e assustador ouvir de Mr. Catra, a seguinte afirmação: “Na realidade não foi o branco que... https://t.co/aKbqmmHVU8",1,pt,"It was unfortunate and frightening to hear from Mr. Catra, the following statement: “In reality it was not the white man who ... https://t.co/aKbqmmHVU8  "
2016,2016,478,"A propósito @homemdeverdade não vai a Campus Party, lugar de baitolinhas sem amigos reais!!!! e muito virgem também.",1,pt,
2017,2017,2670,@Mih_ArmstrongL @otmar03 vamos a agenda feminista TIRADA DO PROPRIO SITE...e agora me diz onde ta a defesa da mulhe _ https://t.co/HpBXM1L6nz,1,pt,@Mih_ArmstrongL @ otmar03 let's go to the feminist agenda TAKEN FROM THE OWN SITE ... and now tell me where is the women's defense _ https://t.co/HpBXM1L6nz  
2018,2018,2956,"@NetMane como diria Trump, Califórnia é  quase México...",0,pt,"@NetMane as Trump would say, California is almost Mexico ...  "
2019,2019,4860,"RT @snsdrug: 'jihyo é feia'
'jihyo é gorda'
porra queria eu ser feia e gorda que nem a jihyo, pfff",1,pt,"RT @snsdrug: 'jihyo is ugly' 'jihyo is fat' fuck I wanted to be ugly and fat like jihyo, pfff  "
2020,2020,2340,"@karlariane ela ta te zoando. ela não liga. acho bom denunciar, mas ninguém sabe direito quem ela é.",0,pt,"@karlariane she is making fun of you. she does not care. I think it's good to report it, but nobody really knows who she is.  "
2021,2021,1911,@gentemagra1 apresenta pra ela miga @homemcis,0,pt,@ gentemagra1 presents her friend @homemcis  
2022,2022,1667,Faço churrasco dessa carne o dia inteiro https://t.co/jartybLaNe,0,pt,I barbecue this meat all day https://t.co/jartybLaNe  
2023,2023,1674,"Falando em tpm, minha menstruação ta atrasada 2 semanas... Se eu não fosse sapatao ia estar preocupada",1,pt,"Speaking of tpm, my period is 2 weeks late ... If I wasn't a shoe I would be worried  "
2024,2024,1107,deus que me livre https://t.co/Me4iTAtUlN,0,pt,
2025,2025,3032,"o #BlocoEsquerda, promotor da Eutanásia, não tinha este tema no seu programa eleitoral. Isto é honesto?
@EsquerdaNet https://t.co/CyYCcDKPj4",1,pt,"#BlocoEsquerda, promoter of Euthanasia, did not have this theme in its electoral program. Is this honest? @EsquerdaNet https://t.co/CyYCcDKPj4  "
2026,2026,2072,"Homem branco hétero cisgênero, me oprimindo durante Protesto pela Revogação do Estatuto do Desarmamento.. _ https://t.co/FWeyMFDQWb",1,pt,"Straight white cisgender male, oppressing me during Protest for the Repeal of the Disarmament Statute .. _ https://t.co/FWeyMFDQWb  "
2027,2027,470,"A possível vitória de Geert Wilders é mais uma esperança para esta Europa em mudança. Força!
@geertwilderspvv 
https://t.co/OvbwfxpjgL",0,pt,Geert Wilders' possible victory is yet another hope for this changing Europe. Force! @geertwilderspvv https://t.co/OvbwfxpjgL  
2028,2028,2200,"Isso não é professora, é uma doutrinadora que usa a audiência cativa das crianças (alunos) para impor suas seitas... https://t.co/qHDBdkJ9bu",1,pt,"This is not a teacher, she is a teacher who uses the captive audience of children (students) to impose their sects ... https://t.co/qHDBdkJ9bu  "
2029,2029,4957,RT @Walgreg: VERDADES QUE PRECISAM SER ESFREGADAS NA CARA DE TODA FEMINISTA. https://t.co/Wji5Q8PCB6,1,pt,RT @Walgreg: TRUTHS THAT NEED TO BE SCRUBBED IN EVERY FEMINIST'S FACE. https://t.co/Wji5Q8PCB6  
2030,2030,1172,Dirigentes da cúpula do #PNR  reuniram ontem em Cantanhede. O trabalho não pára. https://t.co/Fu3aNGRnz8,0,pt,Leaders of the #PNR summit met yesterday in Cantanhede. The work doesn't stop. https://t.co/Fu3aNGRnz8  
2031,2031,5449,"Uma #MulherDeVerdade gosta de agradar e dar carinho ao parceiro, mas não faz NADA  apenas pelo outro, ou que a desagrade.",0,pt,"A #MulherDeVerdade likes to please and give affection to her partner, but she does NOTHING just for the other, or that she dislikes.  "
2032,2032,5273,"Ta proibido fazer piada machista, exceto se vc for o Gregorio na campanha do Freixo",0,pt,"It is forbidden to make a macho joke, unless you are Gregorio in the Freixo campaign  "
2033,2033,5485,unico que saiu ganhando na #BlackFriday hauhauha http://t.co/T8dzPR13,0,pt,the only one who won in #BlackFriday hauhauha http://t.co/T8dzPR13  
2034,2034,2088,@homemdeverdade quando vacila assume rapidamente a responsabilidade e paga o erro com humor!,0,pt,@homemdeverdade when he hesitates he quickly takes responsibility and pays for the error with humor!  
2035,2035,266,"ALÔ FEMINISTAS:
ATÉ UM SISTEMA SOLAR RESOLVEU APARECER
E O SEU PAI NADA https://t.co/ysRnqpzvOX",1,pt,HELLO FEMINISTS: EVEN A SOLAR SYSTEM RESOLVED TO APPEAR AND HIS FATHER NOTHING https://t.co/ysRnqpzvOX  
2036,2036,3589,"pré adolescente?
tenho idade pra ser teu pai
só não sou pq uso camisinha https://t.co/GM9KKDoj8P",0,pt,"pre teen? I'm old enough to be your father, I'm just not using a condom https://t.co/GM9KKDoj8P  "
2037,2037,2159,"Impunidade dos outros, fraqueza dos “nossos”
https://t.co/kDeuLAJE0Y#Iraque #Portugal #PNR #RenovarPortugal",0,pt,"Impunity of others, weakness of “ours” https://t.co/kDeuLAJE0Y#Iraque #Portugal #PNR #RenovarPortugal  "
2038,2038,689,"Bom dia amigos, companheiros, camaradas! Bardamerda para as segundas-feiras...",0,pt,"Good morning friends, comrades, comrades! Bardamerda for Mondays ...  "
2039,2039,4350,"RT @huffpostbrasil: 'Enquanto não for prioridade, não vamos conseguir diminuir os índices de violência contra a mulher' #DiaDaMulher https: _",0,pt,"RT @huffpostbrasil: 'As long as it is not a priority, we will not be able to reduce the rates of violence against women' #DiaDaMulher https: _  "
2040,2040,560,"'até pouco tempo atrás'  Que canalhice!!!!
O retardado compara o Cristianismo da idade média com o islamismo de 201 _ https://t.co/6pcTiHG7G5",1,pt,'until recently' What a heck of a lot !!!! The retarded compares the Christianity of the Middle Ages with the Islam of 201 _ https://t.co/6pcTiHG7G5  
2041,2041,1024,"@d_aleajactaest olha, afinal foi o Islão 'o pai'. Já tens argumento na mesma mas tens de substituir Hitler por ISIS https://t.co/U3Y9xSzAux",1,pt,"@d_aleajactaest look, after all Islam was 'the father'. You already have an argument, but you have to replace Hitler with ISIS https://t.co/U3Y9xSzAux  "
2042,2042,2891,Não se passa nada na Suécia! @realDonaldTrump https://t.co/DB682WoBJK#Sweden #RenovarPortugal #PNR,0,pt,Nothing is happening in Sweden! @realDonaldTrump https://t.co/DB682WoBJK#Sweden #RenovarPortugal #PNR  
2043,2043,3871,"@ronanoliveira_ @jpriscilla26 Cuidado com a burra!  Proteçao na EDIÇÃO, mulher! O programa ta 'pintando' ela como uma vitima e perseguida",1,pt,"@ronanoliveira_ @ jpriscilla26 Watch out for the donkey! Protection in the EDITION, woman! The program is 'painting' her as a victim and persecuted  "
2044,2044,1723,@felipefepacivil  kkkkkkkkkkkkkkk  a abelha sempre voltaaaa  rsrs,0,pt,@felipefepacivil kkkkkkkkkkkkkkk the bee always voltaaaa lol  
2045,2045,1455,Essas escolas são LGBT? Não são escolas públicas? Passamos dos limites e ainda se vitimam e nos acusam de... https://t.co/CYENjm96oD,1,pt,Are these schools LGBT? Aren't they public schools? We crossed the line and still fall victim and accuse us of ... https://t.co/CYENjm96oD  
2046,2046,1052,de certezinha q vai haver gente a usar isto só pq é produto novo da nike qd nem sequer têm qlq ligação c o islão https://t.co/v9kIbPioxu,0,pt,sure that there will be people using this only because it is a new nike product that doesn’t even have any connection with Islam https://t.co/v9kIbPioxu  
2047,2047,4900,"RT @TonhoDrinks: A mídia virou realmente uma inimiga voraz de tudo que não é sua narrativa degenerada! Isso é um absurdo completo!
 https: _",0,pt,RT @TonhoDrinks: The media really became a voracious enemy of everything that is not your degenerate narrative! This is complete nonsense! https: _  
2048,2048,2480,"@maathbz credoo kkkkkkkkk
melhor usar cabelo de homem mesmo...",1,pt,
2049,2049,992,"@csar_emerson @Curate_Angola 2. se prestar atenção, isso não é pornografia. o contexto em que esse beijo foi posto dificilmente tem...",0,pt,"@csar_emerson @Curate_Angola 2. if you pay attention, this is not pornography. the context in which this kiss was placed hardly has ...  "
2050,2050,3716,"'que importa não é ser mulher é se sentir mulher'
AS VEZES ME SINTO O BRÉD PIT, OLHO NO ESPELHO E ACABA
VOCÊ DEVIA SENTIR O MESMO AO URINAR",0,pt,"'what matters is not being a woman is feeling like a woman' SOMETIMES I FEEL THE BRÉD PIT, I LOOK IN THE MIRROR AND YOU FINALLY SHOULD FEEL THE SAME WHEN Peeing  "
2051,2051,2128,ia perguntar se o dia Internacional da mulher era no mundo todo mas parei um pouquinho pra pensar e agora eu to me sentindo BURRA,0,pt,"I was going to ask if International Women's Day was all over the world, but I stopped to think a little and now I'm feeling BURRA  "
2052,2052,2999,Nosso maravilhoso novo plano de saúde pública está em revisão e negociação. O ObamaCare é um total e completo desas _ https://t.co/ba3DBrlKqJ,0,pt,Our wonderful new public health plan is under review and negotiation. ObamaCare is a total and complete challenge _ https://t.co/ba3DBrlKqJ  
2053,2053,184,"Agende seminário ou palestras para liderança, jovens e igreja geral sobre Ideologia de Gênero. 
Com 5 livros... https://t.co/XmSL8gDa8l",0,pt,"Schedule a seminar or lectures for leadership, youth and the general church on Gender Ideology. With 5 books ... https://t.co/XmSL8gDa8l  "
2054,2054,829,"'Cem homens podem formar um acampamento, mas é preciso uma mulher para se fazer um lar.' #MulherDeVerdade",0,pt,"'A hundred men can form a camp, but it takes a woman to make a home.' #Real woman  "
2055,2055,2323,"@jujucardoso10 típicas frases das gajas, pq hj e o dia da mulher! burra!!!!!!",1,pt,"@ jujucardoso10 typical phrases of the ladies, why hj and women's day! stupid !!!!!!  "
2056,2056,4330,RT @g1: Movimentos sociais e coletivos feministas protestam por direitos da mulher em SP https://t.co/5GJ3xjSPqB #DiadaMulher #G1 https://t _,0,pt,RT @ g1: Feminist social and collective movements protest for women's rights in SP https://t.co/5GJ3xjSPqB #DiadaMulher # G1 https: // t _  
2057,2057,3982,"RT @antonutchi: Porque o que mais tem é lobo em pele de cordeiro. Contra a hipocrisia, @justiceiro_sujo neles!",0,pt,"RT @antonutchi: Because what else is wolf in sheep's clothing. Against hypocrisy, @justiceiro_sujo in them!  "
2058,2058,1855,"@gabrielaltairc vc n entendeu que eu falei nao? refugiados nao vem pro brasil, é mt longe",0,pt,
2059,2059,2171,Infelizmente isto não vai lá com petições. Os imbecis que promulgaram tal aberração têm a faca e o queijo na mão e _ https://t.co/JTaQDCXnAw,0,pt,Unfortunately this does not go there with petitions. The imbeciles who enacted such an aberration have a knife and cheese in their hands and _ https://t.co/JTaQDCXnAw  
2060,2060,4576,"RT @MBLivre: Bruno está solto. Presidente do PCO, que quer matar conservadores, nem processo tem. Bolsonaro processado e réu. Estranho. htt _",0,pt,"RT @MBLivre: Bruno is loose. President of the PCO, who wants to kill conservatives, there is no process. Bolsonaro sued and defendant. Weird. htt _  "
2061,2061,720,"BRANCO RICO COM PROBLEMA NA JUSTIÇA: 
PODE TIRAR PHOTO SIM
NEGRO COM PROBLEMA NA JUSTIÇA: 
VERGONHA TIRAR SELF COM _ https://t.co/RmvX3uI6zi",1,pt,RICH WHITE WITH PROBLEM IN JUSTICE: CAN TAKE PHOTO YES BLACK WITH PROBLEM IN JUSTICE: SHAME TAKE SELF WITH _ https://t.co/RmvX3uI6zi  
2062,2062,713,"Bom resultado para o Vitória.
Empatar na casa de um rival directo pela entrada na Liga Europa é sempre positivo
#Bardamerda",0,pt,Good result for Vitória. Draw at a direct rival's home for entry to the Europa League is always positive #Bardamerda  
2063,2063,3394,Passando aqui pra desejar feliz #DiadaMulher  pra quem é mulher desde o ultrassom,0,pt,Passing here to wish you happy #DiadaMulher for those who are women since the ultrasound  
2064,2064,3688,"QUANTA IRRESPONSABILIDADE, DEVE TER MATADO A FAMÍLIA DE DESGOSTO https://t.co/GuzZdgqlCx",0,pt,HOW MUCH IRRESPONSIBILITY SHOULD HAVE KILLED THE DISGRESSING FAMILY https://t.co/GuzZdgqlCx  
2065,2065,3014,"@nyahler Uma pessoa com anorexia se considera GORDO, mas é MAGRO. voce pode se considerar o que quiser...mas biologicamente é so XX ou XY",1,pt,"@nyahler A person with anorexia considers himself FAT, but is SLIM. you can consider yourself whatever you want ... but biologically it's only XX or XY  "
2066,2066,5396,TROCO 2 TOMATES POR UM INGRESSO DO ROCK IN RIO.,0,pt,I EXCHANGE 2 TOMATOES FOR A ROCK IN RIO TICKET.  
2067,2067,843,"Charlie Sheen, to contigo meu querido amigo.",0,pt,"Charlie Sheen, I'm with you, my dear friend.  "
2068,2068,1386,é por isto q adoro fufas  https://t.co/BdGYXdnW10,0,pt,that's why I love fufas https://t.co/BdGYXdnW10  
2069,2069,5038,Se ansiedade matasse por que eu morri?,0,pt,If anxiety killed why did I die?  
2070,2070,2152,imagina se você cutucar a pessoa no facebook só que ela tem hanseníase e não sente,0,pt,imagine if you poke the person on facebook only that he has leprosy and does not feel  
2071,2071,1571,Eu argumentando com um sujeito que acredita que a crise dos refugiados é a pobreza e não o projeto de califado. Desisti de argumentar,1,pt,Me arguing with a guy who believes that the refugee crisis is poverty and not the caliphate project. I gave up arguing  
2072,2072,5286,"Tem brownie aqui em casa, de calabresa https://t.co/hPvIC3VdLj",0,pt,"There's brownie here at home, pepperoni https://t.co/hPvIC3VdLj  "
2073,2073,2028,"10h da manhã e já é hora de pensar onde e o que vou almoçar na pausa do trabalho
O maconheiro acorda 12h e se torn _ https://t.co/YGGXaRNj37",0,pt,10h in the morning and it's time to think where and what I'm going to have lunch on the break from work The stoner wakes up 12h and becomes _ https://t.co/YGGXaRNj37  
2074,2074,571,"Atrasada (@ Universidade Castelo Branco - @ucbrj in Rio de Janeiro, RJ w/ @lupsfreire) https://t.co/jLzVDVRJqG",0,pt,"Delayed (@ Universidade Castelo Branco - @ucbrj in Rio de Janeiro, RJ w / @lupsfreire) https://t.co/jLzVDVRJqG "
2075,2075,5036,"Se a minha namorada também só tivesse 30 segundos para me responder quando discutimos, evitavam-se tantos problemas
#Oscars",0,pt,"If my girlfriend also only had 30 seconds to answer me when we discussed, so many problems were avoided #Oscars  "
2076,2076,4475,"RT @jpintocoelho60: Orgulho em @AntonioGuterre na #ONU? Nunca! O confronto político do nosso tempo é entre o Nacionalismo e Globalismo.
htt _",0,pt,RT @ jpintocoelho60: Pride in @AntonioGuterre in #ONU? Never! The political confrontation of our time is between Nationalism and Globalism. htt _  
2077,2077,5536,"@vanzkafka pra mesmo qdo a gente estiver brigado, eu lembrar que amo ela :)",0,pt,"@vanzkafka even when we're fighting, I remember I love her :)  "
2078,2078,3039,"Obrigada amigos.Já passamos de 600 inscritos em 24 horas. Inscreva-se no meu novo canal de entrevistas.
Vamos... https://t.co/FrF0HqrMx7",0,pt,Thank you friends. We have already over 600 subscribers in 24 hours. Subscribe to my new interview channel. Let's go ... https://t.co/FrF0HqrMx7  
2079,2079,5073,Sendo comunista assim... até eu! https://t.co/A86gESUy11,0,pt,Being a communist like that ... even me! https://t.co/A86gESUy11  
